,title,lyrics,text_author,composer,artist,nr
0,Kiedy w piątek,piątka słońce świecić serce góry wzlatać sobota wziąć plecak podróż świat świat słońce góry pole wiatr pole wiatr obchodzić bom turysta urodzić miesić ciasny wśród pojazd kurz spaliny zielony woleć ścieżka pełny wszędziejski słodki malina leżeć lis myślić wielki dywan przypadek tysiąc świat stań chcieć żeby świat przetrwał tysiąc żeby móc dziecko świat cieszyć,,,Strąkowski,337
1,Ja mam tylko jeden świat,piątka świecić słońce serce góry wzlatać sobota wziąć plecak podróż świat świat słońce góry pole wiatr obchodzić bom turysta urodzić miesić ciasny wśród pojazd kurz spaliny zielony jać ciszyć ścieżka pełny słodki malina świat słońce góry pole wiatr obchodzić bom turysta urodzić myślić leżeć pośród kwiat jęczmień żółty łań przypadek póła wieko świat stań świat słońce góry pole wiatr obchodzić bom turysta urodzić chcieć żeby świat przetrwał tysiąc żeby móc dziecko świat cieszyć świat słońce góry pole wiatr obchodzić bom turysta urodzić,J. Strąkowski,J. Strąkowski,,135
2,Mój świat (Kiedy w piątek słońce świeci),piątka słońce świecić serce góry wzlatać sobota wziąć plecak podróż świat świat słońce góry pole wiatr obchodzić bom turysta urodzić miesić ciasny wśród pojazd kurz spaliny zielony jać ciszyć stok pełny słodki malina myślić leżeć pośród kwiat jęczmień złoty łań przypadek póła wieko świat stań chcieć żeby świat przetrwał tysiąc żeby móc dziecko świat cieszyć,,,Janusz Strąkowski,1122
3,Pod śliwką,iść diabeł ścieżka krzywy pełny myślić zły pożyczyć piwo pożyczyć nikt słońce prażyć rany wiatr gorący dmuchać diabeł noga słaniać piekelny upał iść anioł wśród zielony wieść pełny drobny kieszeń przyjaciel wszędziejski nagle przystanel oba góra śliwka ujrzeć browar wyniść przeciwka szczęście świat ni sprawiedliwość anioł pić piwo trzeć diabeł zazdrość rzec diabeł postawić kufel bóg wynagrodzić artysta upał musieć żyć zgoda anioł zatrzepotać skrzydło pióropusz powiadać dama dycha zamiać dusza musieć diabeł aniołowy wściekły dusza sprzedać stworzyć piekło odrobina niebo,,,,245
4,Anioł i diabeł,iść diabeł ścieżka kręty pełny myślić zły pożyczyć piwo pożyczyć nikt słońce smażyć rany wiatr gorący dmuchać diabeł pragnienie słaniać piekielny upał iść anioł wśród zielony wieść pełny grosz kieszeń przyjaciel wszędziejski nagle przystanąć oba droga śliwa zobaczyć wyniść browar naprzeciwka szczęście świat ni sprawiedliwość anioł pić piwo trzeć diabeł zazdrość postawić kufel mówić diabeł bóg wynagrodzić artysta upał żyć musieć zgoda anioł zatrzepotać skrzydło pióropusz powiadać dama dycha zamiana dusza musieć diabeł aniołowy wściekły dusza sprzedać stworzyć piekło odrobina niebo,Anna Borowa,Andrzej Zieliński,Łucja Prus,302
5,Anioł i diabeł (Pod śliwką),iść diabeł ścieżka krzywy pełny myślić zły pożyczyć piwo pożyczyć nikt słońce smażyć rany wiatr gorący dmuchać diabeł pragnienie słaniać piekielny upał iść anioł wśród zielony wieść pełny drobny kieszeń przyjaciel wszędziejski nagle przystanel oba droga śliwka zobaczyć browar wyniść przeciwka szczęście świat ni sprawiedliwość anioł pić piwo trzeć diabeł zazdrość mówić diabeł postawić kufel bóg wynagrodzić artysta upał żyć musieć zgoda anioł zatrzepotać skrzydło pióropusz powiadać dama dycha zamiana dusza musieć diabeł dusza wściekły aniołowy sprzedać stworzyć piekło odrobina niebo,Anna Borowa,Andrzej Zieliński,Łucja Prus,830
6,Dożywocie gór,drogi mistrz mistrz mej drogi mistrz jerzy mistrz wojciech góry schodzić noga mogąc złapać oddech góry stać dogonić znikać punkt mapa miejsce nazwać dom dotrzeć szlak góry mały żeby przetrwać zima zima wyrok wędrówka koniec ślad zostawić góry góry ciągło skazany góry dożywocie świat dobry zbieszczadzieć szczyt wolny mijać krok pański święty święty bezpański święty jerzy mikołaj mować opuścić góry święty mieszkaniec imię pieśń wychwalać góry stać dogonić znikać punkt mapa ani chata któyy nazwać dom szlaka trafić góry mały żeby przetrwać zima zima wyrok wędrówka koniec ślad zostawić góry góry ciągło skazany góry dożywocie świat dobry zbieszczadzieć szczyt wolny mijać krok góry mały abymorze przetrwał zima zima skazany wieczny wędrówka ślad zostawić góry góry góry dożywocie karko wyrok świat dobry zbieszczadzieć szczyt wolny zbliżać krok,Tomasz Borkowski,B. Adamczak,Na Bani,768
7,Gór mi mało,drogi mistrz mistrz drogi mistrz jerzy mistrz wojciech góry schodzić noga mogąc złapać oddech góry stać dogonić znikać punkt mapa miejsce nazwać dom dotrzeć szlak góry mały żeby przetrwać zima zima skazać wieczny wędrówka ślad zostawić góry góry ciągło skazany góry dożywocie świat dobry zbieszczadzieć szczyt wolny mijać krok pański święty święty bezpański święty jerzy mikołaj mować starodawny góry święty mieszkaniec imię pieśń wychwalać góry stać dogonić znikać punkt mapa chata nazwać dom szlaka trafić góry mały żeby przetrwać zima zima skazać wieczny wędrówka ślad zostawić góry góry ciągło skazany góry dożywocie świat dobry zbieszczadzieć szczyt wolny mijać krok,Tom Borkowski,Wojciech Szymański,Dom o zielonych progach,395
8,Gór mi mało,drogi mistrz mistrz drogi mistrz jerzy mistrz wojciech góry schodzić noga mogąc złapać oddech góry stać dogonić znikać punkt mapa miejsce nazwać dom dotrzeć szlak góry mały żeby przetrwać zima zima skazać wieczny wędrówka ślad zostawić góry góry ciągło skazany góry dożywocie świat dobry zbieszczadzieć szczyt wolny mijać krok pański święty święty bezpański święty jerzy mikołaj mować starodawny góry święty mieszkaniec imię pieśń wychwalać góry stać dogonić znikać punkt mapa ani chata nazwać dom szlaka trafić góry mały,Tomasz Borkowski,Wojciech Szymański,Dom o Zielonych Progach,847
9,Między nami tyle śniegu,ślad zasypać śnieg całies zgubić szukać trudny wszędziejski biały czekać siła ponieść sań stały środek zima lato żyto wniść tył śnieg tył lód trafić siebie okno szyba chłód wiosna odmienić lato da zapomnieć czekać jesień przypomnieć list krzyżówka hasło pięć bilet tramwajowy pewnie zasnąć wciąż myśl bić gdybeyć stanąć próg śnieg pewnie bymorze otrzepać dziękować wiedzieć ko tył śnieg tył lód trafić siebie okno szyba chłód wiosna odmienić lato da zapomnieć czekać jesień przypomnieć,Adam Ziemianin,Krzysztof Myszkowski,Stare Dobre Małżeństwo,13
10,Między nami tyle śniegu,ślad zasypać śnieg całies zgubić szukać trudny wszędziejski biały czekać siła ponieść sań stały środek zima lato żyto wniść tył śnieg tył lód trafić siebie okno szyba chłód wiosna odmienić lato da zapomnieć czekać jesień przypomnieć list krzyżówka hasło pięć bilet tramwajowy pewnie zasnąć wciąż myśl bić gdybeyć stanąć próg śnieg pewnie bymorze otrzepać dziękować wiedzieć ko,Adam Ziemianin,Krzysztof Myszkowski,Stare Dobre Małżeństwo,1060
11,Zawirował świat,chmura skłębić nieść mróz śnieg wiatr gwizdać nieszczelny futryna kolejny raz pociąg spóźniać znak zaczynać zimać zawirować świat płatka śnieg dwór stary wspomnienie odżyły niewiele pomóc królowy śnieg srebrny welon przykryć świat wystawić nos dom próg wyczyn lada śmieć zawirować świat płatka śnieg dwór stary wspomnienie odżyły niewiele pomóc szary poranek krótki dzień siebie tysiąc list stawić piec żar dwieście pięćdziesiąt zawirować świat płatka śnieg dwór stary wspomnienie odżyły niewiele pomóc,Krzysztof Myszkowski,Krzysztof Myszkowski,,268
12,Zawirował świat,chmura skłębić nieść mróz śnieg wiatr gwizdać nieszczelny futryna kolejny raz pociąg spóźniać znak zaczynać zimać zawirować świat płatka śnieg dwór stary wspomnienie odżyły niewiele pomóc królowy śnieg srebrny welon przykryć świat wystawić nos dom próg wyczyn lada śmieć zawirować świat szary poranek krótki dzień siebie tysiąc list strawić piec żar dwieście pięćdziesiąt zawirować świat,Krzystztof Myszkowski,Krzystztof Myszkowski,Stare Dobre Małżeństwo,1121
13,Głupi Gienek,gienek grać gitara szewc g wyniść okno jesień przybijać podkówka chybać przyszłość gitara gienii cienki prosty mały struna gienek wierzyć wieć struna pękać zwłaszczać cienki gienek szewc wbić głowa gwóźdź woli gitara żona gitara brać ślubić gitara gienii cienki prosty mały struna gienek wierzyć wieć struna pękać zwłaszczać cienki,,,Stare Dobre Małżeństwo,327
14,Głupi Gienek,gienek grać gitara szewc wyniść okno jesień przybijać podkówka chybać przyszłość gitara gienii cienki prosty mały struna gienek wierzyć wieć struna pękać zwłaszczać cienki gienek szewc wbić głowa gwóźdź woli gitara żona gitara brać ślubić,A. Ziemianin,K. Myszkowski,Stare Dobre Małżeństwo,1077
15,Jeszcze nie czas,wieczór granatowy płaszcz gwiazda pozapalać kąt wyłazić zrudziały smutki gram gitara cichy nutka zbierać grać raz takt niebieski myślić odganiać czas czas marzyć walizka kłaść czas piosenka śpiewać wiatr czas gitara spała dzień szafa póky tył muzyka zabraknąć przyjaciel wieczór przegadać rany gitara struna melodia parzeę piasek chcieć wsypać oko sn zaprosić odejść dłużeć płakać smutek serce nosić czas marzyć walizka kłaść czas piosenka śpiewać wiatr czas gitara spała dzień szafa póky tył muzyka włożyć dębowy skrzynka niech włożyć raz gitara niech niebo grać struna srebrzysty melodia ukochany czas marzyć walizka kłaść czas piosenka śpiewać wiatr czas gitara spała dzień szafa póky tył muzyka,Andrzej Koczewski,Andrzej Koczewski,,261
16,Jeszcze nie czas,wieczór granatowy płaszcz gwiazda pozapalać kąt wyłazić zrudziały smutki gram gitara cichy nutka zbierać grać raz takt niebieski myślić odganiać czas czas marzyć walizka kłaść czas piosenka śpiewać wiatr czas gitara spała dzień szafa doeć tył muzyka zabraknąć przyjaciel wieczór przegadać rany gitara struna melodia parzeę piasek chcieć wsypać oko sn zaprosić odejść dłużeć płakać smutek serce nosić czas włożyć dębowy skrzynka niech włożyć raz gitara niech niebo grać struna srebrzysty melodia ukochany czas,"Zbigniew Bogdański, Andrzej Koczewski",Zbigniew Bogdański,Andrzej Koczewski,1374
17,Miasto,ciemny noc schód uliczka gorący most kamień pełny piwo łeb nieść chmura gitara pustka kieszeń żegnać miasto stały wieża drogi kroki żegnać miasto most wieczór spadać gwiazda moneta muzyka nazbierać miesić sprawa ważny wart ot podeszwa dziura wylot bit dzwony brama otworzyć gwiazda rzeka zaczynać kończyć opowieść chcieć wieczór siedzieć mość karola,Krzysztof Jurkiewicz,Krzysztof Jurkiewicz,Słodki Całus od Buby,32
18,Miasto,ciemny noc schód uliczka gorący most kamień pełny piwo łeb nieść chmura gitara pustka kieszeń żegnać miasto stały wieża drogi kroki żegnać miasto most wieczór spadać gwiazda moneta muzyka nazbierać miesić sprawa ważny wart ot podeszwa dziura wylot bit dzwony brama otworzyć gwiazda rzeka zaczynać kończyć opowieść chcieć wieczór siedzieć mość karola,Krzysztof Jurkiewicz,Krzysztof Jurkiewicz,Słodki Całus od Buby,1267
19,Zielone szkiełko,stać słońce łapię palka czas nitka babi rok patrzyć świat szkło krata dno butelka włos rozwiać głaskać twarz świat koniec zielony człowiek słońce człowiek leżeć ziemia wdychać zapach trawić obłoki skłębić zielony szkiełko prawda znać wieć iść schylić palka ziębnąć przyjść świta wiedzieć rosa wstyd człowiek ziemia człowiek widmo lecieć przepaść widzieć czarny dno słyszeć krewić stęchnąć żyła spływać twarz powietrze prąd cela znaleźć wybrać znaleźć droga któyy chcieć przejść drugi sn strona zielony szkiełko przecinać dłoń spadać ziemia spadać ziemia promień,Robert Kasprzycki,Robert Kasprzycki,Robert Kasprzycki,312
20,Zielone szkiełko,stać słońce łapię palka czas nitka babi rok patrzyć świat szkło krata dno butelka włos rozwiać głaskać twarz świat koniec zielony człowiek słońce człowiek leżeć ziemia wdychać zapach trawić obłoki skłębić zielony szkiełko prawda znać wieć iść schylić palka ziębnąć przyjść świta wiedzieć rosa wstyd człowiek ziemia człowiek widmo lecieć przepaść widzieć czarny dno słyszeć krewić stygnąć żyła spływać twarz powietrze prąd cela znaleźć wybrać znaleźć droga któyy chcieć przejść drugi sn strona zielony szkiełko przecinać dłoń spadać ziemia promień,,,Robert Kasprzycki,1217
21,Ballada o św. Mikołaju,rozstrzelać chata rozpalić ogień rozwalić piec pieśń wynieść węgleł naciągnąć drzazga gonty błękitny płachta niebo malować nowy wioska dolina święty mikołaj opowiedzieć pieśń śpiewać paść koń chcieć gadać polski wypalić źrenica deszcz płynąć ślepiec nauczyć dziecko łemkowski raz żebrać malować wioska święty mikołaj,Andrzej Wierzbicki,Andrzej Wierzbicki,SETA,871
22,Ballada o świętym Mikołaju,rozstrzelić chata rozpalić ogień rozwalić piec pieśń wynieść węgleł naciągnąć drzazga gonty błękitny płachta niebo malować nowy wioska dolina święty mikołaj opowiedzieć pieśń śpiewać paść koń chcieć gadać polski wypalić źrenica deszcz płynąć ej ślepiec nauczyć dziecko łemkowski raz żebrać malować wioska święty mikołaj opowiedzieć pieśń śpiewać paść koń,Andrzej Wierzbicki,Andrzej Wierzbicki,Seta,217
23,Piosenka turystyczna 2,rajd wyruszać dobry myślić buta mocny zawiązać plecak zarzucić pomyśleć fajn siedzieć ognisko lasa kłaść cień głowa iskra błyskać kilometr zachód słońce echo nieść góry pieśń radosny pieśń koniec góry stały niebo postrzępionyme lasa zielony pępek bania cerkiew zanurzyć rozbić namiota zaraza potok rozpalić ognisko dymić zakręcić łezka oko kilometr zachód słońce echo nieść góry pieśń radosny pieśń koniec wieczór pierwszy gwiazda wystrzelić bełty korki kwaśny cierpki smak wino przełamać bariera pewny dziewczyna namiota leże wcal brzydki pierwszy lód ranka blady echo nieść góry zew miłosny serenada obudzić południe potok toczyć namiot woda porywisty sn budzić dziecko płakać żona nękać podziękować chcieć stachurzć krzysi myszkowski,Krzysztof Jurkiewicz,Mariusz Kamper,Słodki Całus od Buby,352
24,Piosenka turystyczna II,rajd wyruszać dobry myślić buta mocny zawiązać plecak zarzucić pomyśleć fajn siedzieć ognisko lasa kłaść cień głowa iskra błyskać kilometr zachód słońce echo nieść góry pieśń radosny pieśń koniec góry stały niebo postrzępić lasa zielony pępek bania cerkiew zanurzyć rozbić namiota zaraza potok rozpalić ognisko dymić zakręcić łezka oko kilometr zachód słońce echo nieść góry pieśń radosny pieśń koniec wieczór pierwszy gwiazdka wystrzelić bełty korki kwaśny cierpki smak wino przełamać bariera pewny dziewczę namiota leże wcal brzydki pierwszy lód ranka blady echo nieść góry zew miłosny serenada obudzić południe potok toczyć namiot woda porywisty sn budzić dziecko płakać żona nękać podziękować chcieć stachurzć krzysi myszkowski,"K. Jurkiewicz, M. Kamper",K. Jurkiewicz,Słodki Całus od Buby,1268
25,Łabędzi puch,monokl oko podróż wóda śpiew opona nitka drogi sala lustrzany świta blady świta wielki bal biały latawiec góra gwiazda chmurka dmuchawiec ptasi gniazdo jutro niezmiennia kołysać bezsenna kołysać ściana pijany świat koło kręty niezmiennia kołysać bezsenna kołysać różowy tęczowy nieść wiatr mknąć lekki łabędź pucha twarz ekran nuda fałsz mydlany piano uliczny plansza pieski niebieski rzucik krzyżyk raja święty kolęda przyjęcie raut poranny twarz wytworny kształt kłębić wczorać chwila trwać niezmiennia kołysać bezsenna kołysać ściana pijany świat koło kręty niezmiennia kołysać bezsenna kołysać różowy tęczowy nieść wiatr mknąć lekki łabędź pucha,,,Wolna Grupa Bukowina,311
26,Łabędzi puch,monokl oko podróż wóda śpiew opona nitka drogi sala lustrzany świta blady świta wielki bal biały latawiec góra gwiazda chmurka dmuchawiec ptasi gniazdo jutro niezmiennia kołysać bezsenna kołysać ściana pijany świat koło kręty niezmiennia kołysać bezsenna kołysać różowy tęczowy nieść wiatr mknąć lekki łabędź pucha lekki łabędź pucha lekki łabędź pucha twarz ekran nuda fałsz mydlany piano uliczny plażyć pieski niebieski rzucik krzyżyk raja święty kolęda przyjęcie rout poranny twarz wytworny kształt kłębić wczorać chwila trwać,Wojciech Jarociński,,Wolna Grupa Bukowina,1443
27,Bieszczadzki trakt,nadejść czas wabić ogień blask polano królować zły gwiezdny pył ogień łza wycisnąć dymić tańczyć iskra gwiazda śpiewać radosny czas śpiewać raz choć rok młody szybki płynąć wiedzieć starzeć lis lichy śpać przygoda drzwi chodzić ściana las lśnić oko sowa wilczy kwadratoł ryk powietrze drżeć gwiazda przyjazny śpiewać radosny czas śpiewać raz choć rok młody szybki płynąć wiedzieć starzeć dorzuć ogień drwa góra niech płynąć śpiew wiatr ponieść wilgotny świat wieć spotkać połączyć bieszczadzki trakt śpiewać radosny czas śpiewać raz choć rok młody szybki płynąć wiedzieć starzeć,Bogdan Adamek,Bogdan Adamek,,8
28,Bieszczadzki trakt,nadejść czas bawić ogień blask polano królować zły gwiezdny pył ogień łza wycisnąć dymić tańczyć iskra gwiazda śpiewać radosny czas śpiewać raz choć rok młody szybki płynąć wiedzieć starzeć lis lichy śpać przygoda drzwi chodzić ściana las lśnić oko sowa wilczy kwadratoł ryk powietrze drżeć gwiazda przyjazny śpiewać dorzuć ogień drwa góra niech płynąć śpiew wiatr ponieść wilgotny świat wieć spotkać połączyć bieszczadzki trakt śpiewać,Bogusław Adamek,Bogusław Adamek,Wołosatki,461
29,Noc w bacówce,porwać deszcz przegonić wiatr zdać siebie przygodny dom miejsce zagrzać górski niba niebo dziura niebo wiatr łatany bacówka mówić dotyk ręka psuć chwila mroka sprzymierzeniec przygarnąć ciepły ręka echo stary bacówka niebo rodzić przyjaźń dziura niebo wiatr łatany bacówka mówić dotyk ręka psuć chwila,,,,404
30,Noc w bacówce,dorwać deszcz przegonić wiatr zdać siebie przygodny dom miejsce zagrzać górski niba niebo dziura niebo wiatr łatany bacówka mówić dotyk ręka psuć chwila mroka sprzymierzeniec przygarnąć ciepły ręka echo stary bacówka niebo rodzić przyjaźń cosoba,,R. Pomorski,Wołosatki,463
31,Niebo do wynajęcia,tablica ogłoszenie hasło lokal przeczytać przedwczorać ogłoszenie ciekawy tablica ogłoszenie fioletowy flamaster nabazgrać słowo dziwny treść spokój święty święty pański szklanka ciepły herbata poczęstować pomyśleć świetnia niebo ziemia grzech nikt przeliczać nikt szperać szuflada pomyśleć świetnia spojrzeć adres deszcz rozmyć litera wiedzieć spokój święty święty pański szklanka ciepły herbata poczęstować wrócić dom błękit beton splatać babla wysoki sięgać chmura zaparzyć herbata pokój świat myślić stracić pewnie spokój święty święty pański szklanka ciepły herbata poczęstować niebo wynajęcie niebo widok raja niebo wynajęcie niebo widok niebo wynajęcie niebo widok raja niebo wynajęcie niebo niebo wynajęcie niebo widok raja niebo wynajęcie niebo,,,Robert Kasprzycki,225
32,Niebo do wynajęcia,tablica ogłoszenie hasło lokal przeczytać przedwczorać ogłoszenie ciekawy tablica ogłoszenie fioletowy flamaster nabazgrać słowo dziwny treść niebo wynajęcie niebo widok raja spokój święty święty pański szklanka ciepły herbata poczęstować pomyśleć świetnia niebo ziemia grzech nikt przeliczać nikt szperać szuflada pomyśleć świetnia spojrzeć adres deszcz rozmyć litera wiedzieć niebo wrócić dom błękit beton splatać babla wysoki sięgać chmura zaparzyć herbata pokój świat myślić stracić pewnie niebo wynajęcie niebo widok raja spokój święty,,,Robert Kasprzycki,1226
33,Kantyczka z lotu ptaka,patrzyć dobrotliwy bóg ulubiony ludzieek wychodzić rany zboże zginać hardy kark trud patrzyć schylać praca pokorn klęska znosić pytać poprosić ująć trocha łaski niebo dać spokój zamiana chleb udzielić swej miłość sprawiedliwość smuć chrysty chmura widzieć naród bawić chcieć przedmurze pogański krew pławić dymić kuźnia warsztaty praca skarga rok łaski hufiec siła grozić nieczysty dać wsławić chrysty kalwin litwina ubliżać dźwigneień ciężar krzyżni załamać ręka matka boski upadać obyczaj pomóc modły chłostać młodzież szranki ciało stawać nędza gzić krewić gorący sumienie oddech własny trzewia strząsać niedojrzały owoc grzech zbawienie piekło byle żyto uciec czas umierać żyć grzmieć gniew święty handel ludzie zalewać bożyć obcy kupka klient złoty wabić obroża liczyć chciwy żyd niemiec polski czystość kupić dusza kupić ziemia zostawić pośmiewisko hańba talar lepszy kurs wiara wymienić waluta honor pokuta naród tył kwestia naraz wysłuchać zadumać niebieski imię ojciec syn duch,Jacek Kaczmarski,Przemysław Gintrowski,Jacek Kaczmarski; Przemysław Gintrowski,151
34,Kantyczka z lotu ptaka,patrzyć dobrotliwy bóg ulubiony ludzieek wychodzić rany zboże zginać hardy kark trud patrzyć schylać praca pokorn klęska znosić pytać poprosić ująć trocha laski niebo dać spokój zamiana chleb udzielić swej miłość sprawiedliwość smuć chrysty chmura widzieć naród bawić chcieć przedmurze pogański krew pławić dymić kuźnia warsztaty praca skarga rok łaski hufiec siła grozić nieczysty dać wsławić chrysty kalwin litwina ubliżać dźwigneień ciężar krzyżni załamać ręka matka boski upadać obyczaj pomóc modły chłostać młodzież szranki ciało stawać nędza gzić krewić gorący sumienie oddech własny trzewia strząsać niedojrzały owoc grzech zbawienie piekło byle żyto uciec czas umierać żyć grzmieć gniew święty handel ludzie zalewać bożyć obcy kupka klient złoty wabić obroża liczyć chciwy żyd niemiec polski czystość kupić dusza kupić ziemia zostawić pośmiewisko hańba talar lepszy kurs wiara wymienić waluta honor pokuta naród tył kwestia naraz wysłuchać zadumać niebieski imię ojciec syn duch hańba talar,,,Jacek Kaczmarski,674
35,Pożegnanie Liverpoolu,żegnać dostojny starzey porto rzeka mersey żegnać zaciągnąć rejs kalifornia niejeden raz żegnać kochany chwila wypłynąć długi rejs miesiąc widzieć wiedzieć pamiętać zaciągnąć herbaciany kliper dobry statek choć sława zły kapitan starzey burgt pływający piekło zwać żegnać kochany chwila wypłynąć długi rejs miesiąc widzieć wiedzieć pamiętać kapitan płynąć pierwszy raz znać jeśliy dobry żeglarz rada dać toś cholernie wpaść żegnać kochany chwila wypłynąć długi rejs miesiąc widzieć wiedzieć pamiętać żegnać dostojny starzey porto rzeka mersey żegnać wypływać rejs kalifornia wrócić opowiedzieć żegnać kochany chwila wypłynąć długi rejs miesiąc widzieć wiedzieć pamiętać,"Krzysztof Kuza, Jerzy Rogacki",,Cztery Refy,316
36,Pożegnanie Liverpoolu,żegnać dostojny starzey porto rzeka mercey żegnać zaciągnąć rejs kalifornia raz żegnać kochany chwila wypłynąć długi rejs miesiąc widzieć wiedzieć pamiętać zaciągnąć herbaciany kliper dobry statek choć sława zły kapitan starzey burgt pływający piekło zwać żegnać kapitan płynąć pierwszy raz znać jeśliy dobry żeglarz rada dać toś cholernie wpaść żegnać żegnać dostojny starzey porto rzeka mercey żegnać wypływać rejs kalifornia wrócić opowiedzieć żegnać,"Krzysztof Kuza, Jerzy Rogacki",trad.,Cztery Refy,1235
37,Beskid jesienią,pustka świecić hala samotny gniąć świerk granitowy skała zmęczyć rogacz lec słoneczko lidwa wstawać kłaść spać wiatr polano zaczynać liść gnać złoty hora gromadka szukać ptak jesienny porać bliski zima znak buk ogień gorzeć modrzew żółknąć włos rany wschodzić zorza liliowy witać wrzos szałas smutny stać ogień trzaskać pasterz poić źródło owieczka złoty hora gromadka szukać ptak jesienny porać bliski zima znak ucichnąć trąbita juhas zamilknąć śpiew skalny szczyt wiatr śpiewać pośród drzewo południe tatra dumny patrzyć beskidy chmurka rozumny zdobić złoty strój złoty hora gromadka szukać ptak jesienny porać bliski zima znak,,,,106
38,Beskid jesienią (Hora),pustka świecić hala samotny gniąć świerk granitowy skała zmęczyć rogacz lec słoneczko ledwa wstać kłaść spać wiatr polano zaczynać liść gnać złoty hora gromadka szukać ptak jesienny porać bliski zima znak buk ogień gorzeć modrzew pachnieć wrzos rany wschodzić zorza liliowy witać wrzos szałas smutnia stać ogień trzaskać pasterz poić źródło owieczka złoty hora ucichnąć trąbita juhas umilknąć śpiew halny szczyt wiatr śpiewać pośród drzewo południe tatra dumny patrzyć beskidy chmurka rozumny zdobić złoty strój złoty hora,Wawrzyniec Hubka,Jan Busz,Elekt,1139
