,title,lyrics,text_author,composer,artist
638,Chrystus i kupcy,towar krzyczeć chciwy ludzie towar wszelki zaspokoić głód zechcieć kupić odsprzedać połeć hasło wiara kark zwój idea miąższy sn świątynia sytość warga róg obfitość móc uwierzyć świątynia wchodzić drżeć złoty strop wzdąć tłum wrzawa smród tłuszcz spływać ściana głos dźwięczeć trzos płacić brać unieść wynosić kupiec handlarz złodziej żebrak ślinić brudny grosze oczyścić posadzka wykadzić ołtarz niech pusty gmach zabrzmieć echo poszept głos słychać krzyk zniknąć wrzawa robić świątynia tarzeg wyrosły grunt krzyczeć krzyczeć gardło krzyk wykrwawić wierzyć wierzyć wiara sprowadzić bunt daleja brać wleźć płać nastawić ręka plecy brać wracać póky dawać sprzedaj da sprzedać bóg inaczy spoglądać precć bóg inaczy spoglądać precć bóg inaczy spoglądać,Jacek Kaczmarski,Zbigniew Łapiński ,Jacek Kaczmarski
639,Arka Noego,pełny słońce środek rok wśród łagodny fala zielony wrzeć zapamiętały praca stawiać łódź suchy ziemia owad pąk drżeć kwitnąć chłop barki brodzić żyto pracować dzień noc burta poszyt budować arka potop dobyć siła budować arka potop choćba tłumić praca kpić ocalić najdroższy tył budować arka potop odrzucić zbędny gest musza taii łódź zbudować żyto zmieścić nikt wierzyć słowo ważny wieść majątek kłócić łatwy węszyć żer zania sn obudzić maszt ster budować arka potop niech mamić głupiec chór budować arka potop słychać grzmot burzowy chmura zostawić kłótnia pot wiara przeczuć dać raz budować arka potop zania koniec pochłonąć łódź potop mierzyć wyjść burzowy chmura uwierzyć ulewa grzmot grzmot późny krzyk trwoga późny usta błoto wypluwać mą przestroga budować arka potop słyszeć sterować serce fala budować arka potop krzyczeć śmieć budować arka potop własny los łza budować arka potop pierwszy ostatni chrzest,J. Kaczmarski,P. Gintrowski ,Jacek Kaczmarski
640,Warchoł,warchoł krzyczeć zaprzeczać własny prawo ufać wolny woli człowieczy pergamin posłuchać boski ręka diabli szpetniąć piękno woli szabla nagiąć mocny pęknąć niewprawny puścić dłoń pysk odbić stały siła nauczyć robić broń natura służyć sprawa krajać stary zwyklecił byle zrobić janczar uczynić dworak wychwalać zasługa cnota podsycać pochlebstwo wada służyć ochota warchoł nikt da rada lubić tan pełny dzban suty stół tapczan płeć nadobny niesurowy święty bóg słowo ni ksiądz ni okowita piekło straszyć niebo nęcić ani kobita wokół palec okręcić ból głowa skrucha kiszki franca wreszta groza duch kostucha rwać taniec sprawa krajać stary zwyklecił byle zrobić janczar uczynić dworak wychwalać zasługa cnota podsycać pochlebstwo wada służyć ochota warchoł nikt da rada jakbymorze człowiek wosk ręka wódz niewiasta klecha móc zostawić troska ciężar grzech znać stróż mienie sędzia sumienie prawda zakon spekulant odkupienie znać siebie ulepić pokłuć niepotrzebny rzucić ogień pokuta umyć ręka sprawa krajać stary zwyklecił byle zrobić janczar uczynić dworak zły dobry pycha dać żyć grzeszny święty żyć przyjemnie zły dobry pycha dać żyć grzeszny święty żyć przyjemnie,,,Jacek Kaczmarski
641,Pejzaż z szubienicą,prowadzić rozpalony wesołek rumiany baba chłopi pijany siwy dymić góra prowadzić leśny pustkowie góry wyłysieć dziki szczyt szybki prowadzić tańczyć upoić siła korowód iść przejmować człowiek ręka ponieść zostawić tybyć król zostawić tybyć król szczyt widać poprzez drzewo cela drogi bliski stać puścić ziemia szczyt tkwieć tron czekać ramię niski panować stamtąd łatwi chcieć władza podstępny hołdownik taniec śmierć milczenie chór zatańczyć zapanować szubienica zaskrzypieć takt ciężki sznura góra wytrzeszczać gała pokazywać złośliwy jęzor tańczyć należeć kołysać nieśmiały cóż ciekawy zobaczyć jasny przestrzeń widzieć krągłość ziemia wiatr podrzucić czarny lasa lęk tańczyć daleja gęstwina własny cień nikt zobaczyć jasny przestrzeń widzieć krągłość ziemia wiatr podrzucić czarny lasa lęk tańczyć daleja gęstwina własny cień nikt zobaczyć,Jacek Kaczmarski,Przemysław Gintrowski  ,Jacek Kaczmarski
642,Osły i ludzie,dosiąść osioł okrak ryk obwieścić donośny wierzch jeździec wolność wbić żebro ostróg wepchnąć ustęp kostka cukier chwost cąć poprzeka noga zmusić trud trucht zaducha ośli dusić kloaka jeździec spć ogon wypuścić gromadzić plecy małpa śpiewać pieśń łaski zwać mus ryczeć ucho spać trucht kłus mijać wierzchowiec wysiłek ogłuchnąć oślepnąć osioł kopia głowa cień ucho ośli nikt mówić ludziezki ryk śmiech chwalić głaskać chłostać skutek kłus przechodzić galop pędzić zgiąć kolano znieść móc znosić świtać myślić słychać ludziezki głowa podnosić ostróg bóść szpicruta ucho grać jeździec stworzyć siodło jeździec dosiąść da jeździec dosiąść da,Jacek Kaczmarski wg Franciszka Goi,Przemysław Gintrowski ,Jacek Kaczmarski
643,Rzeź niewiniątek,dziecko dziecko chodzić pobawić żołnierz ostrze miecz słońce świecić koń chwiać łeb ucho oko nozdrze wrzeć stypa mucha matka matka puścić pociecha wojak włócznia pałki arkany gratka dzieciak wciąż śmieć rozumieć słowo krewić ostrze miecz zaschnąć sok granat włos arkan zbłąkany babi lato skóra strzępić włóczny proporzec wiatr odtrącać ogień ślad pałka osmalić słońce skóra strzępić włóczny proporzec wiatr odtrącać ogień ślad pałka osmalić słońce ptak ptak chodzić pożywić żołnierz byle ochłap droga leżeć ucho oko nozdrze wrzeć stypa mucha piasek piasek dawny przeszły wojsko sława chcieć zasnąć rozrzucony czaszka zabawa wciąż śmieć rozumieć słowo piasek piasek dawny przeszły wojsko sława chcieć zasnąć rozrzucony czaszka zabawa wciąż śmieć rozumieć słowo wciąż śmieć rozumieć słowo wciąż śmieć rozumieć słowo,Jacek Kaczmarski,Przemysław Gintrowski ,Jacek Kaczmarski
644,Czerwony autobus,pędzić polski dziczyć wertepy chaszcze błoto patrzyć tył żałoba sromota patrzyć przód raz raz cela mgły niebieski kusy chcieć chcieć chcieć czerwony autobus czerwony autobus czerwony autobus mijać czas stoa młody żyd nos zdradzać żyd żyd wstyd przeżyć baba kosz jajo szeptać człowiek wieć krajać żydzić bezpieka czekać czekać czekać morda dać inteligentny twarz słuchać zamiasto mówić tors otulić płaszczyć szyty miara spluwa kierowniczy układ czerwony widzieć wóz bezgłowy dzierżyć kukła generalissimus dzieło marszruta dzieło marszruta dzieło marszruta luza mus robotnik ksiądz ksiądz kosynier modlić kląć bluznąć wierzyć proletariacki herszt kapować zaczynać prosty robić gest ręka łokieć zginać ruszyć lawina ruszyć lawina ruszyć lawina mocny tył starzey dziad objęcie wziąć prawiczka złośliwy czyhać czart nadzieja duszyczka upiór mały rząd zwiesić poręczyć żyła sączyć trąd zatruć udręczyć okno polski tęczyć okno polski tęczyć okno polski tęczyć jechać stąd,Jacek Kaczmarski wg B. W. Linkego,Zbiegniew Łapiński ,Jacek Kaczmarski
645,Hymn,twierdza wyrosnąć ogród krewić oko znieść błękit sytość zabić nawykły głód myślić upodlić dźwignia zaszczyty ukrywać szczuć tropić umieć stanąć prosty mur pochylić chybać nagle uwierzyć boskość żyć oprzeć wszelki pokusa tydzień ostoja grzech dawnieć jedyny uciśniony dusza tysiąc uśmiech rano zadawać krzyczeć agonia męki dawać ciało myślić pieścić widzieć sens nauka harmonia ani umieć śpiewać pieśń świat opuścić zastany postać zaśpiewać hymn dziękczynienie choćba zbawienie stracić zadośćuczynienie zadośćuczynienie zadośćuczynienie wiwat człowiek dłoń nagroda przykazanie bóg oddech walka koniec walka dusza koniec,J. Kaczmarski,P. Gintrowski ,Jacek Kaczmarski
646,Kraj,róg stary mapa krajać tęsknić ojczyzna jabłko pagórek leniwy rzeka cierpki wino miłość niesteta wielki pająk rozsnuć sieć lepki ślina zamknąć rogatka marzyć anioł ognisty miecz pająk sumienie róg stary mapa krajać tęsknić,Z. Herbert,P. Gintrowski,Jacek Kaczmarski
647,Pompeje,odkopywać miasto pompeja odkrywać spodziewany ląd oko ludziezki widzieć dzieje jutro ujrzeć potwierdzić poglądy głupiec tłumić śmiać miara kopanie miejski cień narastać jakbyśa wracać dom wjeżdżać wolny świta wielki miasto cichy sn przerywać nikt pies szczekać łańcuch szastać pies szczekać rwać łańcuch szybki dłoń masować mięsień dostojnik łaźnia własny kołysać brzucho wydawać rozkaz pytać niewolnik pies szczekać boja wielki wybuch bzdura chwila przerwać boleć kość poeta rozkazać śledzić nowy meldować podwładny ciemność mieszkanie kaganek siedź pisać wiersz wiersza potomność pies szczekać targać noc któyy objąć twarz znieruchomieć bzdura chuligan trafić kundel proca mruczeć chcieć wydobyć uległość ciało okno utkwić oko ziemia drżeć czuć objąć tył szepnąć ucho drżeć członek świat zginąć bydło zawyć odwracać głowa długi całować dacha padać gorący pierwszy ziarno pył pies szczekać słychać miesić więzień szarpie krata czuja duszny powiew strażnik otworzyć ludzie żebrak spć mur odpowiedzieć ślinić noga drzemać areszt ratować wypuścić ślinić ślina ciemność błyszczeć czerwony móc pomodlić świątynia tył ostatni postawić bóg uczynić pies szczekać patrzyć płoń niebo piec wyciągać bochenek niezdara ziemia dygotać uciekać stąd chcieć własny głupota ofiara wziąć pieniądz forma chleb pies szczekać koniec zabrać misa ołtarz nikt zobaczyć zniszczyć zdążyć zdążyć noc dzień rozjarzać biec ciężki powietrze spalony ps ostrzegać nikt spuścić łańcuch zastygnąć pysk otworzyć łapa próg wtopić podnieść oko objąć wzrok ulica stragan stadion sklepienie wtema słyszeć szmer padać niebo popiół obsunąć ziemia czyjś szybki nierozważny krok,Jacek Kaczmarski 1979,Jacek Kaczmarski ,Jacek Kaczmarski
648,Ze sceny,ciemność reflektor chronić oświetlać scena dłoń widać mą stężały twarz mroka próbować oko przebić mikrofon wychwytywać dźwięk najlekki oddech usłyszeć stąd przemóc sztywność zacisnąć szczęki wstrzymać myślić niekontrolowany prąd krótki kochany pozwolić chcieć naprawda szczerza wysilić chwila żyto zniknąć niech pokrzyczeć krótki chwila chcieć owak tę chwila krzyk wejść wyjść instrument grać choć oklaskiwać rzęsista wiedzieć krótki chwila długi trwać tył drogi powieść przeszkadzać kurtyna twarz ciągły szept koniec przedstawienie trocha czas widzieć stracić nikt tył krzyczeć krótki chwila żyto zniknąć głośny krzyczeć krótki chwila gwizdać mówić mikrofon głos kulisy móc iść przejmować program prowadzić daleja przerywać warcholić precć płuco strzęp rwać akustyka chrypnąć gorzeć słychać silnieć wzmacniacz głos brzmieć rozciągnąć czas ej mrok wierzyć wieć epoka zmieniać chwila otworzyć drzwi zaraza zobaczyć marny czas gnębić zostawać tył powieć charczeć rozróżniać poszczególny słowo śpiewać wystarczyć przerwać zaśpiewać nowy chwyt gitara wyćwiczyć stary mylić żyto sens krzyczeć żyto pokrzyczeć póky tę chwila stały reflektor zgasnąć wyłączyć mikrofon stąd wyprowadzić zatrzasnąć drzwi niech choć skończyć puenta odchodzić śmieszny ważny wielki stylo potrwać chwila żyć zniknąć niech rozśmieszyć chwila,J. Kaczmarski wg W. Wysockiego 1977,J. Kaczmarski wg W. Wysockiego ,Jacek Kaczmarski
649,Pani Bovary,woń zamorski roślina przyjęcie dom bourgeoisa fortepian gadać miłość wirować frak trzecia pas walka naiwny francja smętny szelest krynolina wachlarz minuta wilgotny brudny piętro spłowieć bury tynk słoneczny zen kochankowie coraz jasny dzień paryski bulwar poranek przerażony miasto mknąć pewność pot zmienić wokół pomysł wujkowie plotki ciotka wieczór latarnia żyto czas tęsknota choć palec cichy wniść czul pieścić emma pluszowy sofa ciepły grzbiet,K. M. Sieniawski,P. Gintrowski ,Jacek Kaczmarski
650,Ballada o spalonej synagodze,żydzić żydzić wstawać płoń synagoga wschodni ściana porosnąć żar powietrze drżeć skakać suchy belka ogień wstawać chronić święty księgi wiara gromadzić ciemń krąg płonąć gmach biegać iskra pejs tlić długi bród oko blask pożar rozpacz strach wznosić próżny modły płoń synagoga trzask krzyk gardłowy belka żar sypać iskra góra lecieć środek żyd widać ręka czarny jehowa jehowa noc zapaść stać wielki kół chmura niski ciemność gwiazda dopalać patrzyć chałat porosły popiół rząd ręka twarz mroka powolić oddalać stały rany deszcz spaść ciągło stały popiół zmieszać szlam żyd spalić żyd spalić śpiewać knajpa wódka włóczęga pijany,Jacek Kaczmarski 1977,Jacek Kaczmarski ,Jacek Kaczmarski
651,Nocny Kamboj,kam koń kam koń wieć żyć kam koń kam koń wieć żyć jechać miasto wielki wielki miasto jechać kambójź koń łatwi żyć zapytać ludzie koń powiedzieć przypierdalać donia zapytać ludzie koń powiedzieć przypierdalać donia łnowy de kam heza noł horseza łnowy de kam heza noł horseza hi dazny noł bi or nota bi łnowy de kam heza noł horseza łnowy de kam heza noł horseza hi dazny noł bi or nota bi letsyn goł biga sitć biga sitć letsyn goł zero łiwałt horses izjer liwa end wejunioezioro łi askompania ju wero iz jor horsyn end ju anser kis maj as end wejunioezioro łi askompania ju wero iz jor horsyn end ju anser kis maj as nieta łoszadi kamboja nieta łoszadi kamboja znajeta kik żyto nieta łoszadi kamboja nieta łoszadi kamboja znajeta kik żyto ujezżać balszoj gorć balszoj gorć ujezżać kambójź łoszadi liegcziy żyto bud sprasziwat ludziei łoszada twaja nieta łoszadi nit szczastia ni chuj budut sprasziwat ludziei łoszada twaja nieta łoszadi ni szczastia ni chuj aktor rola aktor rola wieć żyć aktor rola rola spierdolić wieć żyć jechać miasto mały mały miasto uć aktor rola łatwi żyć zapytać kolega sukces sukces biznes zapytać kolega sukces sukces biznes,"Aktorzy Łódzkiej Szkoły Filmowej, na motywach ścieżki dźwiękowej autorstwa Johna Barry'ego",Aktorzy Łódzkiej Szkoły Filmowej,Jacek Kaczmarski
652,Cesarz,raz cesarz żółty oko drapieżny szczęka mieszkać pałac pełny marmur policjant budzić noc krzyczeć nikt kochać lubić polowanie terror fotografować dziecko wśród kwiat umrzeć nikt śmieć zdjąć portret umrzeć nikt śmieć zdjąć portret zobaczyć dom maska zobaczyć dom maska,Z. Herbert,P. Gintrowski,Jacek Kaczmarski
653,Autoportret Witkacego,patrzyć świat nawyk narkotyk czerwony oko doświadczalny królik wstać stół mozół zacisnąć warga zgłodniały mongoł słuchać słowo dźwięk myślić ferment odstawać ucho naiwny konfident wszędziejski węszyć bandyta koloryt typowy cień nos skrzywdzony semita widzieć kształt rzecz sens istotny czynić wielki jednokrotny odróżnienie państwo wybaczyć wiersz idiota odbić powielacz dosyć sztywny szyja wciąż żyć polityka kryształ pomyje umysł twardy łokieć kopiić rewolucja czerwony paznokieć wrażliwy membrana zat wieczór rany trząść śledziona węgorz wyrwany zagłada świat boja poprawa nastrój wrzeszczeć dziecko ciemny zamknięty pokój krztusić dusza częunioezioro żyć chcieć musza tknąć nikt dama wybrać świat witkacege,Jacek Kaczmarski,Przemysław Gintrowski ,Jacek Kaczmarski
654,Starzy ludzie w autobusie,starzyć ludzie autobus jeździć wybierać wybrać miejsce dawny zajęty zostać tył żeby stać czekać uliczka kręty autobus zacząć gnać dokół obcy plecy tkwieć patrzyć ręka drżeć wciąż mijać uchwyt szarpnąć tracić równowaga wspierać byle oto cofać zniewaga patrzyć wzrok zły przeprosić przybrać stań źrenica pełny groza kierowca wbić kierowca ani dbać wpatrzyć drogi znak przyhamować gnać fotel tkwieć okrak dostęp brak okno dostęp brak drzwi stawać bok duch niedołęstwo drwić właściwy wyjść przystanek dany panika lgnąć drzwi klamka patrzyć skarga kierowca przerwać narzekanie napis wskazywać słowo rozmawiać zabraniać pasażer chór zdławić dobrotliwa skarcić możliwość wstawić pętla zajezdny zjazd,Jacek Kaczmarski 1976,Jacek Kaczmarski ,Jacek Kaczmarski
655,Wiosna 1905,wiosenny dzień zapach lipa deszcz ulica lśnić stuk podkowa siodło skrzypieć koń wiosna poczuć rżeć bandyta złapać miasto prowadzić drżeć koński twarz brzucho drżeć twarz koński brzucho długi czekać tę wiosna piętnaście marsz aleja ujazdowski twarz uśmiech dziecięcy spaść iść drogi swej widzieć myśl pierwszy pisać lista koń wędzidło gryźć ucho drążyć kozacki gwizd dziecko słowo wierzyć sens dziecko marzyć śnić dziecko senior spędzać rzęsa dobry płacić krew dorosnąć umieć żyć dorosły senior marzea śmiech dziecko bić słowo dorosły prawda przeszły widać zza koń znikać kałuża ślad ostroga szabla dzwonić czymż świat pusty ulica pachnieć deszcz drzewo jasny puszyć liść mokry powietrze ciągło krążyć kozacki gwizd,J. Kaczmarski wg obrazu Masłowskiego,Z. Łapiński ,Jacek Kaczmarski
656,Krajobraz po uczcie,ogryźć kość dopić wino resztki jeść szukać pies stół dębowy blat obrać cytryna suchy pestka czereśnia dookoł odeszły dama zatłuścić warga łożnica szeroki ciężki zasłona biały pudel krajać krynolina targać rumieniec fotel rzucić stolica koronacja zaczynać król światowy pokazywać szyk obecny wieć nikt tort dać napis wiwat katarzyna księga doczytać skończyć pisać drukować hymn gorący epistoła spoić pęknąć ściana rysy gryźć pochwała pochwalny gryzmoły odeszły zajęcie senny długotrwały biurko mały królewski zalecieć świt pióro skrzypieć łamać świece świecić oświecić stolica sejm kończyć obrady ręka nieść uśmiechać król ambasador zmieniać rola wiedzieć blisko sława zdrada skończyć ostrzyć kosa sztorc stawiać ruszyć zamek sala pałacowy powywieszać zdrajca stan ziemia pole bitewny powgniatać głowa odeszły sukmana kurta opończa stary męczyć rola powiedzieć wiedzieć skończyć żer wyniść obcy wojskowy patrol król królestwo chodzić spacer kasa utrzymywać dwór wiedzieć niepotrzebny chór zalśnić order imperatorowy państwo ościenny przywrócić spokojność obywatel przeta wolny woli rezygnować pretensja tron polski korona nieszczęśliwie zdarzyć kraj insurekcja pogrążyć chaos stan zniszczyć pieczołowitość przydać świadczyć rzetelność imię ogryźć kość dopić wino resztki jeść szukać pies stół ogryźć kość dopić wino resztki jeść szukać pies stół,Jacek Kaczmarski 1977,Jacek Kaczmarski ,Jacek Kaczmarski
657,Hugo,daleja daleja czas odłożyć pilny plan tył czekać zapraszać wyprawa daleja daleja wstawać zamiasto pójść karuzela szybki przysiad zrób zagrać przyjaciel bawić hugon uczyć hugon pewny niedługi rola właściciel nowy gra komputer żwawy wstawać czekać czekać grać kraina któyy znać wulkaniczny wyścig trwać hugon spytać tato spytać hugon wiedzieć gram hugon śpiewać czas uwierzyć bywać hugon refren brzmieć pomagać wygrywać przyjść czas odłożyć pilny plan góra podskok zrób wypić mleko zamiasto kawa daleja daleja wstawać wczesny porać szybki przysiad zrób uwolnić troll bawić hugon śpiewać hugon pewny niedługi rola właściciel nowy gra komputer dawać dawać brat zabawa czekać czekać grać odłożyć sprawa wulkaniczny wyścig trwać hugon,,,Bartek Wrona
658,Jeszcze w zielone gramy,kolejny grudzień maja człowiek goń szalony pozostawać sto okazja przegapić wytykać chwila mróz upał zima lato szansa dostrzec tył racja zielony gram umierać któryś rany odbić ściana wiosenny deszcz obudzić ruń zielony zimowy śmieć ognisko wiosna spłonąć zielony gram wzrok palić ukłonić palec wygrażać móc kłopot rozpacz dzień długi martwić koniec kleić ważny choć raz miesiąc dyktando nadzieja żeby serce kajecik literka zanotować powtarzać cichy prościuteńki słowo zielony gram umierać spełnić piękny dzień marzyć plan ulegać przedwczesny niepokój stary wróbli strachać boja zielony gram choć skroń niejeden siwy sól mądry oliwa sprawiedliwy różny drogi prowadzić przepaść mknąć długi zielony gram chęć żyć zbrzydnąć strych kleić połamany skrzydło myślić ikaro raz dół runąć powiać zdrowy bymorze raz pofrunąć zielony gram choć żyto doskwierać gram rola naturszczyk sufler najróżniejszy sztuka gram skończyć źle długi,W. Młynarski,J. Matuszkiewicz,Wojciech Młynarski
659,Pastorałka '98,biały mech pokryć mur kamienica ulica bajka królowy śnieg brakować mały dziewczynka zapałki zapomnieć żyć okno wystawić pojawić stroik choinka przyzdobić piękno żłóbek stoa ratusz stary rynek ksiądz szykować kolędować padać śnieg srebrny pył bóg szykować ziemia cud biały pucha ród chmura żyto prosty niebo padać śnieg zimny lód ludzie dziwić dziadek mróz wbrewa natura pora tył dawać ciepły posypać kartka kalendarz przybyły kolejny długi miesiąc perspektywa szalony sylwester stary sąsiad raz pasterka byle ciepły ubranie nocny lampa pomagać gwiazda oświetlać droga nocny kolędnik nowy żyto dwunasty zaczynać anioł dawać popis wisły,Tomasz Fojgt,Tomasz Fojgt,Enigma
660,Niebo,góry pokryć zielony pościelić ułożyć dolina sn strumyk zagrać melodia głos ukołysać matczyny szumieć zasnąć dany noc spojrzeć gwiazda góry spadać księżyc wstyd schować skała gwiazda ukradek góry ulecieć mech otulać wielki kamień góry przyrość stały korzyć świerk przeplatać wij dusza góry zbłądzić chcieć czuwać strzelisty słonecznik pielgrzym zdumiony zastygnąć skała kłębić tłoczyć odbić staw góry szeptać słuchać księżyc uśmiechać gwiazda spaść szczęście skory przylecieć daleki góry choć namiastka niebo,Tomek Fojgt,Tomek Fojgt,Enigma
661,Ludzie z mgły,obłoki rwać strzęp rozczesywać skała splątać kosmyk przelewać rwący potok chmura dal ludzie mgły ścieżka znikać dal wiatr dobierać połonina zielony misterny warkotać kręty szlak szczyt płynąć rozmyć zen śnić bieszczad śnić bieszczad bieszczad wschód słońce rosa góry zlewać niebo drogi wisieć mgła zabłąkany zachód słońce koniec bieszczad wschód słońce rosa góry zlewać niebo drogi wisieć mgła zabłąkany zachód słońce koniec zachód słońce koniec zielony stok oba strona dźwigać kładka świat góry stawać mały człek uciekać toń toń zanikać dal krok stawać coraz wyżejezioro wzbijać niebo ptak szczyt zwieńczyć korona szary skała echo sumienie łatwy usłyszeć,T. Fojgt,T. Fojgt,Enigma
662,Pieśń o poszukiwaniu,pomyśleć gitara ujma dźwięk świat prawda określić kształt nuty nuty nuty obojętność znać myślić dźwięk wyrazić wymiar nabierać dźwięk wyrazić milczenie dźwięk wyrazić milczenie przyszły słowo składać długi zdanie słowo znaczyć świat prawda określić kształt słowo słowo głos brzmienie znać myślić słowo wyrazić wymiar nabierać dźwięk wyrazić milczenie dźwięk wyrazić milczenie nauczyć kreska plama kompozycja świat prawda określić kształt obraza obraza względność znać myślić barwa wyrazić wymiar nabierać dźwięk wyrazić milczenie dźwięk wyrazić milczenie szukać wietr miłość szukać nadzieja zostać niewiele znaleźć tę wiedza prawda znaleźć niech prawda milczenie,Wojtek Belon,Tomek Fojgt,Enigma
663,Wiatraki,wiatry wplątać czarny ręka chmura wełnisty szarpia drzeć kręcić kołować skrzypieć kręcić głuszyć krakać kruk wrona ramię okropny machać machać pierś drewniany brakować dech wierzba kudłaty pędzić przestrach blednąć chałupa czapa mlch kręcić kołować wiercić chrobotać wrzeć czarnoksięski trzepot ręka droga torować wiatry noc włóczyć włos mgły seć łąka wór obłoki sypać żarny rudy wieczór siarka miedź mleć mąka gęsty czarny niebo gwieździsty spadać sieć słońce język struga krew lizać piano zachód tarzać dzień ręka sterczeć krzyż widzieć rozpiąć cień dławić szarpia męczyć rany czarny ramię ostry krzyk niebo krwawić świt rany cień oszaleć skoczyć zniknąć,Władysław Broniewski,Tomek Fojgt,Enigma
664,Szczęście,rozmyślać coraz częunioezioro pewny wieczór chybać szczęście zielony kolor niech zieleń rośnia niech zewsząd otoczyć drapieżnia zachłann miłosia zieleń oko przeczytać tę bajka usnąć przeczytać chcieć szczęście dzień dostać uśmiech zwrócić wiersza niechać żyto oceaniczny dno pływać morski straszydło włos wodorost zielony zielony niesamowicia sen niechać żyto oceaniczny dno,Władysław Broniewski,Tomek Fojgt,Enigma
665,Piosenka pasterska,wiatr powiać mienić ogród wielki cichy łagodny morze piano liść przebiec pot ogród zielony morze góry zielony schodzić rzeka tańczyć flecik pastuszka kwiat różowy złoty powieka cieszyć dziecinny serduszko trawa bujny kolano kłonić jabłko trawa potoczyć musieć twarz przyłożyć jabłko goń oko ogród piękny ogród ogród znaleźć świat ani czysty wiyć żywy woda ni wiosna zatopić lato,Czesław Miłosz,Tomasz Fojgt,Enigma
