,title,lyrics,text_author,composer,artist
0,Sześć błota stóp,sześć błoto stopa sześć błoto stopa uderzyć bęben nadejść czas wrzucić woda wieczny wachcieć trza sześć błoto stopa sześć błoto stopa dziewięć sążeń woda sześć błoto stopa ściągnąć flaga dół uszyć worek kula noga ostatni ścieg krew sześć błoto stopa sześć błoto stopa dziewięć sążeń woda sześć błoto stopa wachta ujrzeć chybać kończyć ziemski podróż hiue dotrzeć weć sześć błoto stopa sześć błoto stopa dziewięć sążeń woda sześć błoto stopa ląd setki milić pozostały ląd chwila sześć błoto stopa sześć błoto stopa dziewięć sążeń woda sześć błoto stopa sześć błoto stopa sześć błoto stopa sześć błoto stopa,Henryk Czekała,Cyril Tawney,Mechanicy Shanty
1,Balonik,płakać dziewczynka balon uciec ludzie mówić płakać balonik henowy płakać dziewczyna chłopiec ludzie mówić płakać balonik henowy płakać kobieta mąż porzucić ludzie mówić płakać balonik henowy płakać staruszka żyto wróć balonik wrócić błękitny,Bułat Okudżawa,Bułat Okudżawa,Bułat Okudżawa
2,Nie patrz na to miła,świat zmienić ogłosić wczorać słynny uczyć przypadek słynny ludziezie myślić całies dobry gość otrzymać zaraza nobel mielić racja całies nieciekawć rów leżeć pierwszy miłość zabawa bawić bawić krzyż szyja dłoń seta niebo zjawić kometa zamknąć oko patrzyć miły powieka znaczyć lepsze widoki siła siła umieć marzyć bawić bawić bieda coraz ważny karabin niić serce zabawa żyć tępy rządzić głowa kretyn kij bejsbolowy patrzyć miły człowiek szanować niech schylać niski głowa chwila moment góry dziękować otworzyć oko całować reszta zamknąć oko miły powieka znaczyć lepsze widoki siła siła umieć marzyć reszta zamknąć oko miły powieka znaczyć lepsze obraza siła siła umieć marzyć,Andrzej Sikorowski,Andrzej Sikorowski,Pod Budą
3,Madonna,polski ruski madonna polski starocerkiewny goreć złoty żywy drewny srebro bizantyjski słowiański śnieżnobiały sukienko bielić płótno trumienny deska polski ruski madonna polski starocerkiewny goreć złoty żywy drewny srebro bojarski carski zasmucić kamienny twarz bojarski carski zasmucić chłopski ikona polski ruski madonna polski starocerkiewny goreć złoty żywy drewny srebro,,,
4,Nie rozdziobią nas kruki,rozdziobać kruk ni wrony ani rozszarpać sztuka poezje wściekły kwadratoł ruszać brua iść piwo niechybnąć brakować stać miejsce niejeden zginąć niejeden zginąć kwiat omamić forsa ni sława pusty dźwięk ścigać postać realny zjawa tren ruszać brua iść piwo niechybnąć brakować stać miejsce niejeden zginąć niejeden zginąć kwiat zdechnąć szybki roić śmierć ziemia płytki frunąć góry ruszać brua iść piwo niechybnąć brakować stać miejsce niejeden zginąć niejeden zginąć kwiat,Edward Stachura,Krzysztof Myszkowski,Stare Dobre Małżeństwo
5,Przechyły,pierwszy raz pełny takielunek brać ster trzymać kurs wiatr pierwszy pocałunek usta sól gorący woda smak przechył przechył fala fala mknąć trzymać dziewczyna wiatr ósemka chybać dma zwrot sztaga ok zaraza zrobić słyszeć kapitana cichy kląć gubić wiatr zamiasto dziób tył kumpel śmiech przechył przechył fala fala mknąć trzymać dziewczyna wiatr ósemka chybać dma burta wychylić naprawda śmiać cichy siedź lepiej procisić neptun żeby spaść kark przechył przechył fala fala mknąć trzymać dziewczyna wiatr ósemka chybać dma krople mgły tęczowy kropla pył tańczyć jacht deska spływać dzień jutro wypłynąć odkryć mór noc żeglarski stary pieśń przechył przechył fala fala mknąć trzymać dziewczyna wiatr ósemka chybać dma,,,
6,Znów wędrujemy,wędrować ciepły kraj malachitowy łąka morze ptak powrotny umierać wśród pomarańcza rozdroże fioletowoszary łąka niebo rozpinać płynność arkada pejzaż powieka miękko wsiąkać zakrzepnąć sól nagi warga wiczor prąd zatoka noc lizać mór słodki grzywa miękki gruszka brzmieć lato wiatr sparzyć pokrzywa fontanna perłowy noc winogrono gwiazda rozdawać wędrować ciepły ziemia wędrować ciepły kraj malachitowy łąka morze ptak powrotny umierać wśród pomarańcza rozdroże wędrować ciepły kraj malachitowy łąka morze ptak powrotny umierać wśród pomarańcza rozdroże fontanna perłowy noc winogrono gwiazda rozdawać wędrować ciepły ziemia wędrować ciepły kraj malachitowy łąka morze,Krzysztof Kamil Baczyński,Grzegorz Turnau,Grzegorz Turnau
7,Makatka z aniołem,twarz twej rumieniec jakbyś uduchowić gruźlica płuco dobroć nieziemski zamykać niebieski kluczyć zamykać niebieski kluczyć najczęunioezioro spotkać przepaść lukrować dziurawy kładka przeprowadzać dziecko noc chcieć oderwać ściana skrzydło gwóźdź przedziurawić zostawać wiek wiek amen najczęunioezioro spotkać przepaść lukrować dziurawy kładka przeprowadzać dziecko,Adam Ziemianin,Krzysztof Myszkowski,Stare Dobre Małżeństwo
8,Bieszczadzki trakt,nadejść czas wabić ogień blask polano królować zły gwiezdny pył ogień łza wycisnąć dymić tańczyć iskra gwiazda śpiewać radosny czas śpiewać raz choć rok młody szybki płynąć wiedzieć starzeć lis lichy śpać przygoda drzwi chodzić ściana las lśnić oko sowa wilczy kwadratoł ryk powietrze drżeć gwiazda przyjazny śpiewać radosny czas śpiewać raz choć rok młody szybki płynąć wiedzieć starzeć dorzuć ogień drwa góra niech płynąć śpiew wiatr ponieść wilgotny świat wieć spotkać połączyć bieszczadzki trakt śpiewać radosny czas śpiewać raz choć rok młody szybki płynąć wiedzieć starzeć,Bogdan Adamek,Bogdan Adamek,
9,"Ach, kiedy znowu ruszą dla mnie dni",minąć miesiąc minąć czas miejsce przystanąć chłopiec piekło odgłos kroki schód serce wciąż skakać gardło piękny zagłada ruszyć dzień noc dzień pora krążyć zacząć obieg krew lato jesień zimać wiosna boliwia drogi prosty wiosna lato jesień zimać przypominać ni żyć umrzeć wypłakać łza doszcć oddychać lidwa ból kość gardło stawać powietrze bóg bóg bóg wszędziejski obłęd bóg wbić wszytki nóż ruszyć dzień noc dzień pora krążyć zacząć obieg krew lato jesień zimać wiosna boliwia drogi prosty wiosna lato jesień zimać przypominać,Edward Stachura,Krzysztof Myszkowski,Stare Dobre Małżeństwo
10,"Wiatr, wiosenny gitarzysta",wiatr gitarzysta grać akacjowy listek pograć odchodzić wracać smucić akacja zapaść noc róża chować senny trawa ptak składać skrzydło twardy sośnia akacja skarżyć żałośnąć polecieć szaleniec jj liść szumieć gdziejeste wracać srebrny wariat srebrny ciepły latarnia wietr wietr pustka usta listek listek listek przyciskać wietr wiosenny gitarzysta kwiat wietr wiosenny leśny ścieżka gitarzysta gondoliera wietr wiosenny piosenkarz długi marzyć wrócić wiatr zimowy wicher,,,
11,Dokąd nas zaprowadzisz Panie,zaprowadzić bagaż ból głowa droga stań móc zacząć nowy wiedzieć słońce choć deszcz chronić parasol przemoczyć serce deszcz spływać twarz zabrać uśmiech dzień rany zostawiać lustro śniadanie pośpiech zdążyć kolejny autobus jutro jutro zaraza pierwszy wakacje rozliczać geniusz geniusz zjadacz chleb kolacja jutro zaprowadzić bagaż ból głowa droga stań spróbować zacząć nowy zaprowadzić bagaż ból głowa droga stań móc zacząć nowy,,,
12,Jedyne co mam,jedyny złudzić móc własny pragnienie jedyny złudzić móc siebie własność zabrać prywatność zrobić siebie żyć siebie żyć jedyny złudzić móc własny pragnienie jedyny złudzić móc słowo własny stwierdzić zbyt ciasny zrobić słowo żyć słowo żyć jedyny złudzić móc własny pragnienie jedyny złudzić móc serce kluczyć wymyślić zrobić serce żyć serce żyć jedyny złudzić móc własny pragnienie jedyny złudzić móc myślić spokojny wywołać wojna zrobić żyć żyć jedyny złudzić móc własny pragnienie jedyny złudzić móc,,,Pod Budą
13,Między nami tyle śniegu,ślad zasypać śnieg całies zgubić szukać trudny wszędziejski biały czekać siła ponieść sań stały środek zima lato żyto wniść tył śnieg tył lód trafić siebie okno szyba chłód wiosna odmienić lato da zapomnieć czekać jesień przypomnieć list krzyżówka hasło pięć bilet tramwajowy pewnie zasnąć wciąż myśl bić gdybeyć stanąć próg śnieg pewnie bymorze otrzepać dziękować wiedzieć ko tył śnieg tył lód trafić siebie okno szyba chłód wiosna odmienić lato da zapomnieć czekać jesień przypomnieć,Adam Ziemianin,Krzysztof Myszkowski,Stare Dobre Małżeństwo
14,Dylan -- pastisz,ocean śpać horyzont drwić płytki fala fałszywo mienić prawdziwy rejs znać miejsce płynąć przekór przestrzeń drogi parać noga dotrzeć pewny koniec potrzebny wzrok żeby wyczuć krok musieć wciąż radzić słońce wielbiciel sługa tłumić zawisnąć noga wolność twej chciwy strażnik zaprowadzić przejść granica zlekceważyć głos wróżyć los wyzwolić zabić lasa ręka klaskać czas marsz rytm śmierć nieść boleć patrzyć pić żreć żywić krew żonglować słowo pieśń śnić najlepiej wiedzieć istnieć wszak śnić śmierć twej płakać śmiać drwić jedyny cela eskorta oddać któś rząd dusza własny szlaka ruszyć zdarzyć porta mówić żeś zbiec wyjść brzeg zdradziecki lampa zapalić patrzyć dal płynąć wśród fala wreszta stanąć fala,Jacek Kaczmarski,Jacek Kaczmarski,Jacek Kaczmarski
15,Wasza Wysokość Kobieto,ciemność ciszyć bieda osnuć dom wysokość kobieta naprawda żarówka pełgać oko krople mur spływać nagi kobieta wysokość tył odwaga przyjść pożar zapierać decha huczeć wokół prosić środek prosić warta stać próg naprawda miły pleść wiedzieć drzwi pomylić ulica miasto stulecie,Bułat Okudżawa,Bułat Okudżawa,Bułat Okudżawa
16,Chłopaki nie płaczą,mówić żyto cukierek gorzki mówić panna zostawić kumpel dawny olać bój minia czas poczuć chłodny świta przejść chłopak płakać chłopak płakać kaska odpuścić jutro dzień kiedyś pomóc wystawić bój minia czas poczuć chłodny świta przejść chłopak płakać chłopak płakać,,,T.Love
17,Gonić marzenia,włóczęga wyruszyć przyszły porać lasa wół śpiew ptak szum drzewo wołać pole jezioro zeszłoroczny wesoły pomnieć śpiew ludzie prace ludzie lubić bogacić pełny brzuch chcieć pełny trzos gonić gonić marzyć szukać szczęście kaczeniec wrzos prosty gadać szkoda czas plecak wziąć iść siebie szukać wiatr zapach szukać las najdaloja zadymiony wielki miasto zrozumieć brat łóżko trawa dach drzewo wiatr gonić ptak śpiewać głos gonić gonić marzyć czekać troska przynieść los iść lubić mówić widzieć dzień spotkać iść świat dogonić marzyć spełnić złoty zen dziewczyna ręka gitara piosenka precć smutki precć przykrość słońce świecić iść gonić iść gonić marzyć spokój szukać pośród starc drzewo,Jurij Kukin,Jurij Kukin,Jurij Kukin
18,Przyjaciółko,przyjść znać domowy drzwi materac zmęczyć fotel wysiedzieć musieć dzwonić pukać wejść posiedzieć pomyślić pogadać miłość chcieć przyjść przyjaźń wystarczyć ciężki bywać źle walka przegrany powrót tarcza łatwi martwić przyjaźń trwać choć świat choć jutro boja wyjść rany zmęczyć trudny rozmowa zostać wspólny łza dusza zostać słowo choć miłość chcieć przyjść przyjaźń wystarczyć choć ciężki bywać źle choć zdarzać powrócić tarcza trwać lepiej zmieniać świat przyjaźń żyć rośnia trwać dzięki trocha mało świat boja,Jakub Onufry Wojtaszczyk,Jakub Onufry Wojtaszczyk,Znak służby muzyce
19,Tawerna pod pijaną zgrają,niebo morze przytulać płacz lichy sosna garbaty reszta wykrzywiać brzeg morze wędrować bezdomny tułaczy nikt wieć iść wiatr przywiać tawerna pijany zgraja tańczyć rozhukany ściana dziewczę serce złamany grosz oddawać pytać kip drań wiatry noc chmurny przegonić woda póła słońce póła niebo póła morze rozpalić opuszczać wędrowiec uśpić gospoda pierwszy bryza znikać pomarszczyć dal tawerna pijany zgraja spływać smutek okopcić ściana dziewczyna póła grosik amulet układać kochanie tęsknota żalić chandra jesienny mgły otoczyć postawić karta przegrany zamiasto siedzieć bezczynna płakać psioczyć wziąć węzełek plecy ruszać świat znać tawerna pijany zgraja tańczyć rozhukany ściana dziewczę serce złamany grosz oddawać pytać czyś kip drań pytać czyś kip drań pytać czyś kip,Grzegorz Bukała,Grzegorz Bukała,Grzegorz Bukała
20,Pocałuj noc,palka zwykły dzień oglądać świat pośpiech gubić zen śmiech zawstydzać woleć śmiać chwila śmieszny spróbować choć raz odsłonić twarz spojrzeć prosty słońce zachwycić prosty wzruszyć najmocnieć bój bać chcieć płakać iść szukać wiatr pole pocałować noc najwysoki gwiazda zapomnieć tańczyć zakładać szary płaszczyć łatwy wtapiać upiornia trzeźwy świta obmyślać gest wypadek nikt odkryć oto naprawda spróbować choć raz odsłonić twarz spojrzeć prosty słońce zachwycić prosty wzruszyć najmocnieć bój bać chcieć płakać iść szukać wiatr pole pocałować noc najwysoki gwiazda zapomnieć tańczyć,,,Varius Manx
21,Zwiewność,brzęk mucha pusty dzban stoa półka smuga oko znikły okno jaskółka cień ręka murawa niczyj ledwa zazielenić ufać żyć dumniąć modrzyć ciszyć podnóże buńczuczć bój mgły napurpurzać niewiele mało niebieski ć tło biały obłok liliowy przekreska dal światły ślepie wróbli spotkanie trwać ciało szmer studnia lis mgły bywać usta aleja świta grobla młyn niebo brama oścież zgon pszczoły koniczyna brzęk mucha pusty dzban stoa półka smuga oko znikły okno jaskółka cień ręka murawa niczyj ledwa zazielenić ufać żyć chód ziemia człowiek widnokres maleć łatwy zwiewny gęstwy ciało nieść gęstwia modlić gmatwać chwila wyzierać gęstwa świat motyli brzęk mucha pusty dzban stoa półka smuga oko znikły okno jaskółka cień ręka murawa niczyj ledwa zazielenić ufać żyć,Bolesław Leśmian,Z. Stefaniak,
22,Żegluj,żeglować żeglować nowy szkocja żeglować żeglować wstawać nowy dzień głos nowy szkocja przynosić wiatr zapowiedzieć nowy dzień wół ryk fala znaleźć nowy świat dumny brzeg witać majestat groźny skała dzień świt przywitać coraz lkki stań własny dom stań żeglować żeglować nowy szkocja atlantyk bić fala stromy brzeg wściekleł ryczeć pośród skała góra dziki ptak słychać śpiew głos płynąć wiatr dal bujny trawa kołysać łan strumyk cichy szept mej pamięć trwać niedługi powiedzieć niedługi powiedzieć żeglować żeglować nowy szkocja żeglować żeglować nowy szkocja,,,Szanty
23,Easy Rider,miesić roboty większość poeta skończyć popyt wsiąść auto rzec porać uciekać polski kochać człowiek rów przydrożny ubarwić mlecz zapraszać wędrowiec wstąpić miasteczko easa rider przeszły głowa easa rider głupiec słowo ciagnąć panna ciepły poranek mleko skwasić wnosić ganek easa rider easa rider miasteczko pierwszy zamknięty jedyny hotel personel wolny tę sobota prywatny mieszkanie drzwi otworzyć blondyna zapytać miejsce poglądy sprawiedliwość prawda paść odpowiedź zjeżdżać aktywista easa rider przeszły głowa easa rider głupiec słowo ciągnąć daleja wierzba malować dziewczyna ładny pisanko easa rider easa rider następny domek ogródek miejski prokurator róża kolka przycinać równy ciąć sekator przywitać grzecznie prosić mieszkanie zapytać zdanie sprawiedliwość prawda paść odpowiedź odejść ekstremista easa rider przeszły głowa easa rider głupiec słowo ciągnąć gościnny wioska częstować miód bigos easa rider easa rider solidny domowy pruski cegła siatka ogrodzić brama tabliczka obcy wstęp wzbronić ganek gospodarzyć czerstwy bochenek wziąć przywitać pytanie cenić sprawiedliwość prawda burka brać miastowy widowisko easa rider przeszły głowa easa rider głupiec słowo ciągnąć strona daleki swojski pachnieć siano człowiek easa rider easa rider minąć miesiąc mej samotny droga szlak zatrzymać pojazda wędrowiec sprawiedliwość prawda rzec rodak pierwszy spytać podzielić chleb kłopot easa rider piechota easa rider,Krzysztof Daukszewicz,Krzysztof Daukszewicz,Krzysztof Daukszewicz
24,Wielki Wóz,noc ciemny świerkowy spadać głowa iść zmierzch ociemniały blask dzień księżycowy latarnia niebo mroka ogarniać płony gwiezdny latarka żeby jaśnieć żeby jaśnieć wędrować cygański obóz nocować gwiaździsty groń wielki wóz jutro wielki wóz wielki wóz mały wóz jać mleczny droga wieźć mały wóz wielki wóz szczyt góry kryć całun rzeka mgły roznuwać iść zmierzch ociemniały blask dzień zorze karmin wypalać jaśnieć gwiazda pozwalać płony gwiezdny latarka żeby jaśnieć żeby jaśnieć wędrować cygański obóz nocować gwiaździsty groń wielki wóz jutro wielki wóz wielki wóz mały wóz jać mleczny droga wieźć mały wóz wielki wóz ciepły dotyk twej dłoń chłód wieczorny przegonić iść zmierzch ociemniały blask dzień ścieżka wij kręty szlaka drzewo pamiętać płony gwiezdny latarka żeby jaśnieć żeby jaśnieć wędrować cygański obóz nocować gwiaździsty groń wielki wóz jutro wielki wóz wielki wóz mały wóz jać mleczny droga wieźć mały wóz wielki wóz,,,
25,Pan Kmicic,wilczy ząb oko siwy groźnia garść obuszek furczeć gniew zawód wichr zryw dziki radość lot jaskółczy czyn czyn zapaść klamka puścić kura zaścianek szlachta kmicic hajdać wołmontowicz przodek kula oko krótki rozkosz dać sikorka łeb napatoczyć kije sto chudopachołek pot pita obłęd studnia śnieg jędruś szlachta kmicic hajdać wołmontowicz zdrada krzyż krzyż przysięgać krucyfiks cyrograf oddalać oleńki żądza wychłostać bat siec obcy sprawa chłopiec szlachta kmicic hajdać wołmontowicz wreszta lek dusza blizna polski sukno radziwić wróg prywatny wróg ojczyzna niespodzianka jakże miły los sumienie panna strata wynagrodzić spór magnat szlachta kmicic hajdać wołmontowicz jasny góra czas pokuta trupić trupić kmicica strzelać łuk klasztor płaszcz mgła zasnuć szwedzki armata straszny huk jędrek granat bawić ksiądz kordecki błogosławić szlachta kmicic hajdać wołmontowicz nagroda cierpienie śmieć korzystać dawny grzech odpuścić król jędk skroń ściskać tatar droga ruszać radować bóg rzeźa prus szlachta kmicic hajdać wołmontowicz krzyż ojczyzna bóg prywata warchoł oko zmieniać skóra wierny topór kata podobny natura słuszny sprawność ręka ręka oleńki łaski król dworka dziecko szlachcic przykład świecić szlachta kmicic hajdać wołmontowicz,Jacek Kaczmarski,Jacek Kaczmarski,Jacek Kaczmarski
26,Broadway,ulica przetaczać bajeć barwny tłumić migotać reklama woda silver moon drapacz drapać wierzchołek brzuch chmura dół przejeżdżać gigantyczny wóz sznura broadway broadway kolorowy piękny karty broadway broadway zachwycać świat róg ulica czterdzieści starzey murzyn wirtuoz gitara blues grać namiętno czarny umieć blues grać serce włożyć żeby człowiek dać broadway broadway kolorowy piękny karty broadway broadway zachwycać świat zatrzymać żyto quartrativus dać słyszeć mówić czarny grać ruszać bar móc znieść czuja przechodzień blues drzemać treść broadway broadway kolorowy piękny karty broadway broadway zachwycać świat któryś popołudnie grać marny grosz stanąć gitara niepozorny biały gość choć gitara amator grać wyśpiewać genialnia czarny serce broadway broadway kolorowy piękny karty broadway broadway zachwycać świat skończyć koncert starzey murzyn zaprosić kolejny popołudnie blues głos pot spytać znać me niedola usłyszeć odpowiedź brat m from polć broadway broadway kolorowy piękny karty broadway broadway zachwycać świat,Krzysztof Daukszewicz,Krzysztof Daukszewicz,Krzysztof Daukszewicz
27,Już rozpaliło się ognisko,rozpalić ognisko dawać dobry wróżba znak sieść blisko polsce siedzieć siedzieć harcerka płomień ciepły blask ogień skupiać zły szukać cień światły dobry garnąć mówić druhna komendantka zaufanie wierzyć dobry chęć harcerski serce znać warunki warunki dawny wszak słyszeć harcerka zwyciężyć wszelki zły,,,
28,Ci wszyscy ludzie,ludzie pójść precć żyć żyć rzecz rzecz stawka wina przebić rzecz rzecz stawka wina przebić ludzie kazać minąć pośpiecha nagły pośpiecha nagły nieodwracalnia pamięć ginąć świat kształt odchodzić diabeł nieodwracalnia pamięć ginąć świat kształt odchodzić diabeł ludzie wiedzieć wiedzieć grób rozmówić temat wiedzieć wiedzieć grób rozmówić temat ludzie wokół kiki kiki niegodny rozmówić niegodny łaska żyć błądzić racja niegodny rozmówić niegodny łaska żyć błądzić racja ludzie pominąć pochować żyć pozwalać żyć pamiętać wysłuchać żyć pozwalać żyć pamiętać wysłuchać,Jacek Kaczmarski,Jacek Kaczmarski,Jacek Kaczmarski
29,Jesienne wspominanki,letni wieczór wspomnienie wracać bumerang wygasły ognisko płomień tlić zen twarz ślad opalenizna myć bledy zaczynać wstydzić golizna zaczynać ubierać ciepło odwijać wspomnienie szpulka wyświetlać ściana kolor przekładać plecak biurko długi wieczór ciepło ubrany sweter gruby skarpeta wełniany niespokojnie kaloryfer wpatrzyć nużyć grzać wcal pociecha sięgać pudło wyciągać stary fotografia zapatrzyć cichy myślić lato odwijać wspomnienie szpulka wyświetlać ściana kolor przekładać plecak biurko długi wieczór okno pierwszy płatka śnieg choć zimać mieszkanie zimny biegun ciągło myślić czekać przyszły dany przygoda widzieć sznura ptak niebo jesień straszyć niepogoda odwijać wspomnienie szpulka wyświetlać ściana kolor przekładać plecak biurko długi wieczór,Maciej Służała,,
30,Jaką cenę...,ludziezie świat unieść wciąż móc kręcić poeta choć wiersza pozostać pamięć nazwać nazwać czekać człowiek tajemnica dźwigać kamień wieć rzekać noc zmęczyć liść wielki drzewo zaledwie kaprys gałęzie zostawić ślad stopa niebo niebieski kora mały móc cena zapłacić ziemske cichy przebywać skrzypka usłyszeć wiedzieć grać śliwka rozebrać pestka poznać śliwkowy błękit spotkać kamień rzeka znudzić poeta strona czekać senior zen chować dzień dojrzeć poziomka lato koniec opisać poranny wróbli szary piórko ubrać podejść koło kamień woda dziwny świat zgoda,Adam Ziemianin,Krzysztof Myszkowski,Stare Dobre Małżeństwo
31,Lekcja historii klasycznej,galia estopień omnisić divisa in partes tresa quorum unam incoluna belge aliamorze aquitancia tertiamorze qui ipsorum linguativus celtain noster galić apelantura ava caesaa moriture salutant europa twardy krok legion grzmieć nieunikniony wróżyć koniec republika gnić wzgórze galijski pomieszany krew juliusz cezar pisać pamiętnik galia estopień omnisić divisa in partes tresa quorum unam incoluna belge aliamorze aquitancia tertiamorze qui ipsorum linguativus celtain noster galić apelantura ava caesaa moriture salutant pozwolić cezar zdobyć świat gwałcić rabować sycić wszelki pożądanie prosty prośba żołnierz juliusz cezar milczeć zabawić zabraniać galia estopień omnisić divisa in partes tresa quorum unam incoluna belge aliamorze aquitancia tertiamorze qui ipsorum linguativus celtain noster galić apelantura ava caesaa moriture salutant cywilizować podbić naród nowy łada rosny krzyż drogi ren nieo skarga krzyk płacz rozbrzmiewać świat juliusz cezar ćwiczyć lapidarność stylo galia estopień omnisić divisa in partes tresa quorum unam incoluna belge aliamorze aquitancia tertiamorze qui ipsorum linguativus celtain noster galić apelantura ava caesaa moriture salutant,Jacek Kaczmarski,Jacek Kaczmarski,Jacek Kaczmarski
32,Miasto,ciemny noc schód uliczka gorący most kamień pełny piwo łeb nieść chmura gitara pustka kieszeń żegnać miasto stały wieża drogi kroki żegnać miasto most wieczór spadać gwiazda moneta muzyka nazbierać miesić sprawa ważny wart ot podeszwa dziura wylot bit dzwony brama otworzyć gwiazda rzeka zaczynać kończyć opowieść chcieć wieczór siedzieć mość karola,Krzysztof Jurkiewicz,Krzysztof Jurkiewicz,Słodki Całus od Buby
33,Płacz moja wodo,powiedzieć długi wytrzymać zimać mróz mróz zimać woda rzeka wiedzieć wiedzieć stać brzeg przepaść blisko tłumić gromadzić widowisko nagle zjawić kamień szyja pożegnać tyee płakać woda rzeka łza stoa kolejka szereg daleki kamień rzeka nikt płakać krzyczeć wół łza skończyć wczorać wieczór tył ludziezie bezprzerwa pocieszać spotkać droga nowy mojżesza pewnie podążać tę strona przyjść stanąć znużyć wierzyć choć tyee płakać woda rzeka łza brzeg pojawić diabeł woda zbudować przeprawa tłumaczyć skromnie smutny sytuacja judasz ruszyć most rzeka świat diabeł raz niedola dopomóc powrócić kamień dom nikt witać choć tyee płakać woda rzeka łza,,,
34,Szkic do portretu,nikt grać gitara częsty ogień pośród patrzyć gwiaździsty niebo skłon siadać śpiewać brzask piosenka szukać szum trawić wsłuchiwać potok śpiew dźwięk zasypiać miasto wiatr szept korona drzewo grać grać grać wołać zbliżać świta grać grać grać noc zapomnieć nikt dbać wygląd ni szmal daleki wszelki szpan wciąż zapatrzyć siny dal włóczyć pudło minąć ładny parzeę odkąd widzieć podobny zginąć szlaka odejść raz ranny mgły grać grać grać wołać zbliżać świta grać grać grać noc zapomnieć nikt,Mariusz Zadura,,
