,title,lyrics,text_author,composer,artist
294,Morskie opowieści,rum zaszumieć głowa świat nabierać treść chętnie słuchać człowiek morski opowieść chcieć niechać słuchać chcieć niech słuchać balsam ucho morski opowieść spć hel raz dmuchnąć żagle zedrzeć moc nadludziezki patrzyć koja przywiać nagi babka pucki niech drżeć gitara struna niech wiatr grzywacz pieścić płynąć bandera morski opowieść pływać raz morze majtki czort rasputina bestia kręcić kabestan handszpak kolejka nalać kielich wznieść zrobić doskonal morski opowieść łajba morski statek sztorm wiatr dmuchać gest cierpieć krajać niedostatek morski opowieść chcieć niechać wierzyć chcieć niech wierzyć zależeć wypić pływać raz marynarz żywić wyłącznia pieprz sypać pieprzyć konfitury zupa mleczny zżymać mówić zdrożny wieść klimat morski opowieść,,,
295,"Tango na głos, orkiestrę i jeszcze jeden głos",ciemny niewiele widzieć pamiętać niewiele ciemny wiedzieć pochylić głowa stać stoa kościół stać widzieć ciemny słyszeć wciąż głos głos głos podejść blisko podejść skruszyć obywatel przedstawiciel władza podejść blisko wiedzieć ucieczka błyskawiczny zaradzić pójść posłuchać ciemny wciąż myśleć czyj głos głos głos wróg głos cichy subtelny polski nieskazitelny bóg zaraza zapytać światopogląd celny wróg pewny głowa tużeński usłyszeć głos głos głos szczęście moment żyć przyszły kraj wisły szczęście krajać szczęśliwy piękny prawdziwy ludzie uczynny serce niewinny krajać szczęśliwy ciemny móc stwierdzić ko pomylić epoka stulecie ciemny mickiewicz zgrabnie romantyczny wiara krzesać trocha zorientować kraj kochany dawny widzieć norwid pleść łza znad planeta spadać grób przeciekać wiedzieć słowo czekać m oda norwid filozof okryjbida czyj głos głos głos ciemny wiedzieć dom wprost dojść siebie ciemny czuć niebo choć wiedzieć wiedzieć pochylić głowa stać wierzyć zwariować dziecko powtarzać głos głos głos szczęście moment żyć przyszły kraj wisły szczęście krajać szczęśliwy piękny prawdziwy ludzie uczynny serce niewinny krajać szczęśliwy,Grzegorz Tomczak,Grzegorz Tomczak,Grzegorz Tomczak
296,Przemijanie,dzień kolejny minąć dzień przynieść skończyć nowy wyrosnąć tył dzień minąć tył marzyć tył ludziezie przeszły tył zdarzyć tył marzyć senny spełnić tył dobry gwiazda ubyć tył słowo powiedzieć słowo znaczyć urazić czyjś oko płakać tył dzień minąć tył marzyć tył ludziezie przeszły tył zdarzyć tył marzyć senny spełnić tył dobry gwiazda ubyć czas mijać minąć dzień ko zaświecić słońce dobry oko mgnienie tył dzień minąć tył marzyć tył ludziezie przeszły tył zdarzyć tył marzyć senny spełnić tył dobry gwiazda ubyć,,,
297,Życie to nie teatr,żyto teatr mówić ciągło opowiadać maska coraz coraz mylny zakładać zabawawszystko grać otworzyć zamkniętychdrzwiay grać żyto teatr odpowiadać żyto kolorowy maskarada żyto straszniejszei piękny blednąć blednąć śmierć teatr prawdziwy uronić łza najwyżejezioro góra wznosić brew źle źle dusza ramię ciągło zbudować rano kaleki bankieta artysta wybierać gość niedostępny tylariera tańce alkohol pewnie flirt drzwi otworzyć zamknąć pot cześć wpaść chwila zania spuchnąć atmosfera wódka wypić otema szybki si pozbierać wyjść ulica fontanna zmoczyć łeb wyjść przestworze przecudowny stworzyć wiersza teatr prawdziwy uronić łza najwyżejezioro góra wznosić brew zaraźliwy śmiech grać refren p,Edward Stachura,,
298,Łabędzi puch,monokl oko podróż wóda śpiew opona nitka drogi sala lustrzany świta blady świta wielki bal biały latawiec góra gwiazda chmurka dmuchawiec ptasi gniazdo jutro niezmiennia kołysać bezsenna kołysać ściana pijany świat koło kręty niezmiennia kołysać bezsenna kołysać różowy tęczowy nieść wiatr mknąć lekki łabędź pucha twarz ekran nuda fałsz mydlany piano uliczny plansza pieski niebieski rzucik krzyżyk raja święty kolęda przyjęcie raut poranny twarz wytworny kształt kłębić wczorać chwila trwać niezmiennia kołysać bezsenna kołysać ściana pijany świat koło kręty niezmiennia kołysać bezsenna kołysać różowy tęczowy nieść wiatr mknąć lekki łabędź pucha,,,Wolna Grupa Bukowina
299,Zielone szkiełko,stać słońce łapię palka czas nitka babi rok patrzyć świat szkło krata dno butelka włos rozwiać głaskać twarz świat koniec zielony człowiek słońce człowiek leżeć ziemia wdychać zapach trawić obłoki skłębić zielony szkiełko prawda znać wieć iść schylić palka ziębnąć przyjść świta wiedzieć rosa wstyd człowiek ziemia człowiek widmo lecieć przepaść widzieć czarny dno słyszeć krewić stęchnąć żyła spływać twarz powietrze prąd cela znaleźć wybrać znaleźć droga któyy chcieć przejść drugi sn strona zielony szkiełko przecinać dłoń spadać ziemia spadać ziemia promień,Robert Kasprzycki,Robert Kasprzycki,Robert Kasprzycki
300,Pytania syna poety,poeta kachmyta milczeć syn pytać drogi ojciec wydać kawałek chleb prosić tato chleb kupić rata poeta kachmyta milczeć syn pytać prawda starzey przykład paryżyć wielki płot rozlepić bezrobocie poeta kachmyta milczeć syn pytać drogi ojciec wydać kawałek chleb prosić tato chleb kupić rata poeta kachmyta milczeć syn pytać lepsze żyć tato skończyć studium łopata wrzucać węgiel kopalny wyżymać mózg pralny poeta kachmyta milczeć syn pytać sportowy ostry miłość wpływać zgubn otyłość lova stora diabeł wart skończyć bękart przestać pytać nocka poeta kachmyta milczeć syn pytać drogi ojciec wydać kawałek chleb prosić tato chleb kupić rata zamknąć oko possać smoczek chcieć zmienić pieluszka pomodlić łóżeczko obrońca granica rejtan kochanie najwysoki ludziezki racja umiłowany partia poeta kachmyta milczeć syn pytać drogi ojciec wydać kawałek chleb prosić tato chleb kupić rata,,,
301,Kubuś,stół stoa wazonik pierdut wazonik kamień piękno wazonik zadzwonić cichutki spadać ziemia łóżko śpać babcia babcia trocha głuchy mej babcia pomóc włożyć drut ucho walczyk grzeczny kubusia znany miasteczko noc majtki siusiać grzecznie bawić piaseczek dziadkowy trzydzieści fajeczka ćmy nałogowy zamieniać tytoń amfora mieszanka ciuta ciuta wybuchowy dziadek noc obudzić fajeczka zapalić cichy buchnąć cybuch babcia szukać strych walczyk grzeczny kubusia znany miasteczko noc majtki siusiać grzecznie bawić piaseczek tata aparat wracać dom oduczyć kawa wsypywać brom mama wzgląd powiedzieć móc zły wszelki wypadek zupa dolewać kwas solny walczyk grzeczny kubusia znany miasteczko noc majtki siusiać grzecznie bawić piaseczek góra mieszkać sąsiadka luby mamusia jutro rany butelka mleko nasiusiać malutki córeczka sąsiadka cichy brama zaszkoczać siła ściągnąć majteczki gumka wyciągnąć proca walczyk grzeczny kubusia znany miasteczko noc majtki siusiać grzecznie bawić piaseczek rośnia kubusia malutki rośnia kubusia wspaniały rośnia chluba naród przepraszać naród mały,,,
302,Świerszcz,kołysać ciepły wiatr coraz wolno płynąć czas senior odpływać świat wiedzieć grać wieczorny koncert stworzyć świerszcz budzić wspomnienie czas błyszczeć księżycowy mgła szczyt góry grzbiet fala noc czas otulić ciepły koc zapatrzyć setki gwiazda ognisko płomień topić noc wiedzieć grać wieczorny koncert stworzyć świerszcz budzić wspomnienie czas błyszczeć księżycowy mgła szczyt góry grzbiet fala noc czas uciec ptak gniazdo kwiat zasnąć pośród trawić znużyć usnąć lasa chybać wiedzieć grać wieczorny koncert stworzyć świerszcz budzić wspomnienie czas błyszczeć księżycowy mgła szczyt góry grzbiet fala noc czas,,,
303,Pożegnanie Liverpoolu,żegnać dostojny starzey porto rzeka mersey żegnać zaciągnąć rejs kalifornia niejeden raz żegnać kochany chwila wypłynąć długi rejs miesiąc widzieć wiedzieć pamiętać zaciągnąć herbaciany kliper dobry statek choć sława zły kapitan starzey burgt pływający piekło zwać żegnać kochany chwila wypłynąć długi rejs miesiąc widzieć wiedzieć pamiętać kapitan płynąć pierwszy raz znać jeśliy dobry żeglarz rada dać toś cholernie wpaść żegnać kochany chwila wypłynąć długi rejs miesiąc widzieć wiedzieć pamiętać żegnać dostojny starzey porto rzeka mersey żegnać wypływać rejs kalifornia wrócić opowiedzieć żegnać kochany chwila wypłynąć długi rejs miesiąc widzieć wiedzieć pamiętać,"Krzysztof Kuza, Jerzy Rogacki",,Cztery Refy
304,Stary cowboy,preria szary spływać mroka step wieja wiatr rozsiodłać koń starzey cowboy ognisko sieść płomień resztka siła tlić dorzucić parzeę drwa wieczorny mgły nieść śpiew wiatr chłód byle koń wiatronóg druh colt lasso bat chłód wiatr pamiętać starzey koń gdymić żebrak marzyć kupić domowy człowiek żyła pasać bydło żyto wiedzieć colt bat ciebia tę pieśń wiatr chłód byle koń wiatronóg druh colt lasso bat chłód wiatr rano wygnać cowboy e bydło step stary pochować stary szkapi kulać łeb morze preria dal cowboy ów znikać sznura wiatr nieść pieśń szumieć bór wiatr chłód byle koń wiatronóg druh colt lasso bat chłód wiatr,,,
305,Kołysanka dla Joanny I,zania senior oko spłynąć myślić szybować lufcik żeby ujrzeć ów chwila włos czesać lustro zasnąć ciepły pościelić zmęczyć długi przelot ptak głowa skrzydło wtulać patrzyć senior spokojny niech przyśnić pora niech grać śnąć tańczyć jesień prężyć liść lot lato upał słoneczny zimać śnieg wiosna miłek wiosenny łąka spać myślić czuwać parapet okno,,,Wolna Grupa Bukowina
306,Bieszczadzki rajd,zebrać siadać przyjaciel zaśpiewać rajd rajd bieszczadzki rajd słońce deszcz iść przyjaciel chcieć harcerz przeżyć chcieć bieszczadzki rajd wzmocnićswój siła jeść pajda rajd rajd bieszczadzki rajd słońce deszcz iść przyjaciel chcieć chleb brakować fajny poratować braterski gest rajd rajd bieszczadzki rajd słońce deszcz iść przyjaciel chcieć kiedyś rok wszysć spotkać obsiąść ogień koło zaśpiewać rajd rajd bieszczadzki rajd słońce deszcz iść przyjaciel chcieć,"Piotr Frankowicz, Julian Jaworz-Dutka","Piotr Frankowicz, Julian Jaworz-Dutka",Wołosatki - Grube Dudy
307,Piosenka turystyczna 3,świta okno budzić ptak butelka wionąć nuda chybać pójść położyć zbudzić tamten rudy wyglądać końcówa dawny pospać zrobić zapalić kieliszek flaszka dobry zmartwienie znać kieliszek świta zastać butelka móc wypić dno trzeci raz trzecia pewny starzyć chcieć łożyć wiedzieć dowiedzieć wydziedziczyć napewny wojsko pytać zreszta kieliszek flaszka dobry zmartwienie znać kieliszek świta zastać butelka móc wypić dno kumpel siedzieć góry jeść pić lulka palić zjawiać szkoła chybać koniec wywalić układać kobita naprawda załapać klimat koniec chybać czas żeiwać wyniść kieliszek flaszka dobry zmartwienie znać kieliszek świta zastać butelka móc wypić dno wypić dno wypić dno,,,
308,Sielanka o domu,domowy bukowy koniyć pachnieć słoneczny wieczór usiąść wiatr grać zegar ściana gwarzyć iść zegar tika tika tika świeca skwierczyć mrugać przewrotnia puszczać oko dobry humor dobry humor szukać szukać dom gitara pióro góry niebo niebo góry głos usłyszeć drzwi czyjkolwiek wejść poprosić zbieracz głos domowy luby śmiech ściana rozjaśniać gędźby luby pieśń wpaść parzeę chwila los zawieść strona domowy otwór stoa szukać szukać dom gitara pióro góry niebo niebo góry zaprosić dzień noc zaprosić cztery wiatry drzwi otworzyć podać pierwszy tona zagrać góry koncert buk pora pachnieć nasiąknąć ściana gra zmęczyć wędrownik odpocząć pozwolić muzyka domowy domowy domowy szukać szukać dom gitara pióro góry niebo niebo góry,Wojciech Bellon,Wacław Juszczyn,
309,Osada,jezioro lasa otwierać wrota rozbić namiota przejmować wokół bratni serce pomóc zabić zły zapomnieć las zielony osady pośród wzgórze tętnieć krewić niech ponieść gromki śpiew hymn ocalić osada pośród wzgórze czas liczyć wciąż nowy odkrywać świat lasa brat przystań zastanowić nowy nieść nowy dzień zapomnieć las zielony osady pośród wzgórze tętnieć krewić niech ponieść gromki śpiew hymn ocalić osada pośród wzgórze czas liczyć wyjechać stąd smuć pewny spotkać żyto dobry lekcja da zabrzmieć piosnka zapomnieć las zielony osady pośród wzgórze tętnieć krewić niech ponieść gromki śpiew hymn ocalić osada pośród wzgórze czas liczyć,,,
310,Sanctus,święty święty święty blask kłuć oko święty święty święty ziemia nosić święty kurzyć droga święty kij noga święty krople pot święty kamień pole przysiąść święty płomyk rosa święty wędrować święty chleb chleb łamanie święty sól sól witać święty cisza święty śpiew znojny łomot prawy serce słup oko zapatrzyć bit powieka zadziwić święty rucho drobny stopa święty święty święty ziemia nosić słońce ludzieny niebieski zwierzyniec baran lewo skorpion ryba sferyczny drogi mleczny obłok magellana meteor gwiazda przedporanny saturć saować dziwy wieniec trzy pierścień księżyc dziewięć neptun pluton uran marzes merkur jowić święty chleb chleb łamanie święty sól sól witać święty cisza święty śpiew znojny łomot prawy serce słup oko zapatrzyć bit powieka zadziwić święty rucho drobny stopa święty święty święty ziemia nosić,Edward Stachura,Krzysztof Myszkowski,Stare Dobre Małżeństwo
311,Obława,skulić ciemny jama smaczeń spała spała mały wilczek zupełnia ślepy wtema starzey wilk przewodnik żyto znać łeb podnieść warknąć groźnia szarpnąć dreszcz poczuć nagle wokół siebie nienawistny woń woń tłumić wszelki spokój zrywać zen daleki krzyknąć nagle krótki rozkaz goń cztery strona wypaść cztery gończy ps obława obława młody wilki obława dziki zapalczywy gęsty lis wychować krąg śnieg wydeptać kręg plama krwawy ciało wilczy kieł gończy pies szarpany rzucić niewiele szczęście wypaść prosty kwadratoł krewić trysnąć rany gdymić łapa siła siebie prosty rwać ujrzeć mały wilczek strzęp rozszarpać zginąć ślepy ufny puszysty kłębek bezradny świat zły wiedzieć zdławić zginąć starzey wilk choć żyto znać yy naraz walczyć pies rano yy naraz krwawy obława obława młody wilki obława dziki zapalczywy gęsty lis wychować krąg śnieg wydeptać kręg plama krwawy ciało wilczy kieł gończy pies szarpany wypaść otworzyć przestrzeń piana pysk toczyć strona zły otaczać woń myśliwy dojrzeć śmieć oko ręka pewny niezawodny podnosić góra broń rzucać bok oślepić gnać ziemia spć łapać tryskać padać pierwszy strzała kark rozszarpywać wciąż pędzić słyszeć kląć krewić płynąć pysk strzelać raz drugi pudłować obława obława młody wilki obława dziki zapalczywy gęsty lis wychować krąg śnieg wydeptać kręg plama krwawy ciało wilczy kieł gończy pies szarpany wyrwać obława schować lasa szczęście chybać przyznać leżeć śnieg nieżywy długi długi czas strzała ć zostać krwawy blizna skończyć obława spać gończy ps ginąć ciągło wilki młody wielki świat dać siebie zedrzeć skóra broniić brat wilec broniić wyginąć obława obława młody wilki obława dziki zapalczywy gęsty lis wychować krąg śnieg wydeptać kręg plama krwawy ciało wilczy kieł gończy pies szarpany,Jacek Kaczmarski,Jacek Kaczmarski,Jacek Kaczmarski
312,Skóra,stać ulica stać twarz twarz przechodzić trzeć łokieć wzrok pluć twarz szept mówić mały patrzyć cywilizować świat pot obejmować odpływać dal dochodzić obcy głos wolny płynąć czas odpływać otchłań gwiazda mały zanucić tarzea tarzea tarzea tarzea stać ulica śmiech wkołyć przechodzić trzeć łokieć pluć mały twarz głośny mówić mały patrzyć cywilizować świat pot przestawiać nos upaść wstać dookoł głos sto skóra drań padać mały nucić tarzea tarzea tarzea tarzea obejmować odpływać dal dochodzić obcy głos wolny płynąć czas odpływać otchłań gwiazda mały nucić tarzea tarzea tarzea tarzea,,,Aya Rl
313,Rozstaje,wychodzić rozstawać zadumać trwać pochłonąć bezmiar pochłonąć dal oko widok nasycić ukryć palto wspomnienie cichuteńki drżeć naokoło drogi drogi bury ginąć koniec dzień drogi drogi mądrość cela wychodzić rozstawać oniemieć trwać trudny znaleźć kształt oto ciężki słuchać siebie oto chcieć głośny strach szeptać móc zboczyć źle naokoło drogi drogi bury ginąć koniec dzień drogi drogi mądrość cela wychodzić rozstawać osłupienie trwać dojść którędy dzień dedć dążyć nasycić drogi siebie pomyślić iść wyznaczyć ścieżka któyy zmierzyć naokoło drogi drogi bury ginąć koniec dzień drogi drogi mądrość cela,,,
314,Głupi Gienek,gienek grać gitara szewc g wyniść okno jesień przybijać podkówka chybać przyszłość gitara gienii cienki prosty mały struna gienek wierzyć wieć struna pękać zwłaszczać cienki gienek szewc wbić głowa gwóźdź woli gitara żona gitara brać ślubić gitara gienii cienki prosty mały struna gienek wierzyć wieć struna pękać zwłaszczać cienki,,,Stare Dobre Małżeństwo
315,Bagno,wujek euzeźć dać cegła żebymorze zbudować zamek cegła dać wujek euzeźć zbudować zamek skalisty podłoże utonąć bagno podłóż skalisty dusza wujko euzebiusza wujek euzeźć chcieć cegła wujko euzebiusza wujek euzeźć niesteta utonąć bagno podłóż skalisty reszta cegła wziąć ciotka matylda ciotka matylda zbudować zamek nowy skalisty podłoże utonąć bagno podłóż skalisty ciotka matylda wylecieć powietrze palić fajka atmosfera pełny metan duży dziura wpaść ciotka matylda duży dziura następny cegła wyłowić bagno wędka ciotka matylda wujko euzebiusza wyłowić bagno brzydki starzyć śmierdziel śpiwór szeć śpiwór szeć pójść rozum tłuszcza zbudowal cegielnia cegła wyjąć bagno zrobić cegła zbudować zamek skalisty podłoże utonąć bagno podłóż skalisty kamień nerkowy mały śliczny zajączka kamień nerkowy wyłowić osła krowa prosty bagno pójść dno cegielnia zasada zachowanie masy dzień bagno pot osła krowa wyłonić nagle muł muł zrobić cegła osioł krowa zbudować zamek sprytny postawić zamek żabi łapka stać piękny zamek sięgąć wieża niebo zamek stać długi grzmotnąć piorun grzmotnąć piorun zamek piorunochron piękny chromowy piorunochron długi kamień nerkowy mały śliczny zajączka stresujący szczególnia żabi łapki nagle skoczyć pięć milić daleja żabi łapka pięć milić daleja skalisty bagno zamek pójść dno wytrzymać napięcie powierzchniowy pieśń kończyć kartka kończyć zapisany godzina poranny budzić czary marzey zmieniać gitara,"21. WDH ,,Stare Żbiki''","21. WDH ,,Stare Żbiki''","21. WDH ,,Stare Żbiki''"
316,Piosenka napisana mimochodem,słońce błysnąć wschód zachód mimochód obrysować miasto chmura dziegieć dzień nakarmić miód głowa wznieść napiąć sznura trocha stary stań młody strzepnąć ptak kolejny kroplić pióro mimochód mimochód strzepnąć kroplić pióro noga róża kobierzec tamto kłoda pozostały mimochód byle frustrat skarga słać laureat pisać oąa raz dobry jawić zło raz dobro zły słowo wpadać mór słowo kamień woda krążek myślić pozostawić brnąć dno mimochód mimochód krążek myślić brnąć dno cierpieć syty pojąć zdjąć głód zgłodniały mimochód syty złość most przęsło domowy ogród któś chodzić chodzić stracić pożytek szkoda złośliwa ps rzucić kość mimochód mimochód ps rzucić kość tańczyć walczyć ziać żar zionąć chłód mimochód spalić pył ścąć lód bóg słomiany szarpia broda dać nadzieja źdźbło ład łut senior jawa brać kara nagroda odtwarzać krótki scherzo nuty mimochód mimochód krótki scherzo nuty rym wywieść mimochód układać cierpki pieśń pocieszyć dodać osłoda drzemać mimochód ważki treść chwila światły wschód zachód wobecórka trudny prosty przejść mimochód mimochód trudny prosty przejść mimochód mimochód miasto chmura chwila szczęście,Jacek Kaczmarski,Jacek Kaczmarski,Jacek Kaczmarski
317,Zamieszkamy pod wspólnym dachem,zamieszkać wspólny dach obcy zamknąć drzwi posadzić dom kwiat noc zerwać nikt przynieść suchy drzewo żeby zima źle parzeę jabłko trocha chleb starczyć wieko przeczekać los kaprys żeby pot żyć normalnia zamieszkać wspólny dach obcy zamniąć posadzić dom kwiat noc zerwać nikt przygotować suchy drzewo żeby zima źle parzeę jabłko trocha chleb starczyć dzień,Andrzej Sikorowski,,
318,Piosenka o zajączku,mały czas mały piach dziecięcy garść rzeka zwierać powieka zatrzymać obraza wspomnienie uciekać blednąć kolor płynąć płynąć rzekać szary łąka płynąć płynąć realnieć rzeka zielony zajączka biec wciąż biec siebie siebie tęczyć rozgarniać ręka letni upał wytrzeć suchy spotniały wilgotny pamięć blednąć kolor płynąć płynąć rzekać szary łąka płynąć płynąć realnieć rzeka zielony zajączka rzeka jaszczurka trawa wij słońce chylić zrudziały wieczny zieloność zachować oko pragnąć mały blednąć kolor płynąć płynąć rzekać szary łąka płynąć płynąć realnieć rzeka zielony zajączka blednąć wspomnienie płynąć rzekać koniec początek nasyć me oko kolor rosa drzwi otworzyć zajączek,,,Wolna Grupa Bukowina
319,Ballada na urodziny,brodzić smuga cień widzieć zachodzić słonko ojciec matka przyjaciel paęę cmentarz kwitnąć kwiatek słońce świecić świat zżywać żartować pić choć stół wciąż ubywać kolejny jesień mijać żyto uciekać robić dobry minąć zły gra nadzieja jutro czekać,Józef Baran,Krzysztof Myszkowski,Stare Dobre Małżeństwo
320,Wróżba,niebo krążyć kruk wojna wypowiedzieć wróg zabić krukać prosty rzecz wróg odejść precć zabić krukać prosty rzecz wróg odejść precć chcieć strzelić donia załadować broń trafić broń ręka rychły przyjść daleki ciąg wypalić brat żeby kulić zaświstać rój kula żalić trafiać raz głowa brzucho wróg druh wróg druh roznieść pucha krążyć kruk czerwony mgła strzelić łeb,Bułat Okudżawa,Bułat Okudżawa,Bułat Okudżawa
321,Ballada o Janku Wiśniewskim,chłopiec grabówka chłopiec chylonii milicja użyć broń dzielnieść stały celn rzucać janek wiśniewski paść drzwi ponieść świętojański naprzeciwić glina naprzeciwić tanka chłopiec stoczniowiec pomścić druh janek wiśniewski paść huczeć petarda ścielić gazy robotnik sypać raz padać dziecko starc kobieta janek wiśniewski paść zranić drugi zabity krewić polać grudniowy świt partia strzelać robotnik janek wiśniewski paść stoczniowiec gdynia stoczniowiec gdański iść dom skończyć walka świat dowiedzieć powiedzieć janek wiśniewski paść płakać matka darmy stocznia sztandar czarny kokarda chleb wolność nowy polska janek wiśniewski paść,,,
322,Wędrówka z cieniem,ulica mokry ciemny tło prószyć latarnia wlec cień cień wlec kałuża lśnić noga dawny źle zostać zupełnia wlec cień cień wlec kałuża lśnić noga zawieść cień zawieść dziewczyna wlec wlec kałuża lśnić noga mówić kaprys drwić kierować wlec wlec kałuża lśnić noga czas cień cieszyć cień mamić wlec wlec kałuża lśnić noga mówić żal kpić wiedzieć mówić kłamać wlec cień cień wlec kałuża lśnić noga pocieszać wzajeść iść długi ulica wlec cień cień wlec kałuża lśnić noga,Jacek Kaczmarski,Jacek Kaczmarski,Jacek Kaczmarski
323,Wspomnienia,rok brudny przepocić sala gimnastyczny kanadyjski szkoła dziewczę tańczyć para chłopiec trocha pijany podpierać drabinki gimnastyczny kieszeń pobrzękiwać butelka tani wadliwy wino owocowy cent franki lać śpiewać jesabela przypiąć żelazny krzyż pierś swej podejść najwysoki dziewczę blonda powiedzieć znać wielki błąd pokazać powiedzieć pokazać gadać pokazać nagi ciało kolekcja motylić majtki kratka skoncentrować czekać następny zwrotka niełatwy zadanie aktorski tekst wynikać musieć wcielić rola niewinny jasnowłosy kanadyjski nastolatka chodzić odtańczyć najciemny kit odepchnąć ręka wyraźnie czuja głos wielki głód dotknąć zechcieć móc pokazić pokazić żyć pokazić nagi ciało kolekcja motylić majtki kratka tańczyć blisko zespół zagrać star dusta konfetti balonik lecieć prosty szepnąć minuta zakochać uroczysty chwila musza wierzyć pokazać pokazać koniec pokazać nagi ciało kolekcja motylić majtki kratka,Leonard Cohen,,
324,Kiedy w piątek,piątka słońce świecić serce góry wzlatać sobota wziąć plecak podróż świat świat słońce góry pole wiatr pole wiatr obchodzić bom turysta urodzić miesić ciasny wśród pojazd kurz spaliny zielony woleć ścieżka pełny wszędziejski słodki malina leżeć lis myślić wielki dywan przypadek tysiąc świat stań chcieć żeby świat przetrwał tysiąc żeby móc dziecko świat cieszyć,,,Strąkowski
