,title,lyrics,text_author,composer,artist
941,Tańczący z czasem,niebo mur zawiesić ptak strach noc zanurzyć łza zapatrzyć bliski dal odrzucać starzey ból zanurzyć odeszły czas ostatni wielki król iść iść iść tańczyć widzieć płynąć płynąć płynąć tańczyć błazen powitać kiedyś błądzić drogi zagubiony pośród góry szukać podkowa błoto uciekać pies milczeć słyszeć krzyk milion czarny kół taniec widzieć nikt zbyt szybki żyć tłumić iść iść iść tańczyć widzieć płynąć płynąć płynąć tańczyć błazen powitać iść iść iść drogi tańczyć błazen powitać tańczyć tańczyć tańczyć nocny niebo widzieć,Maciej Augustyn,Eugeniusz Olejarczyk,KSU
942,Moje Bieszczady,góry niebo zielony krzyk polny drogi pośród kwiat złamany krzyż strumień skryty mrok zdziczeć sad stary cerkiew modrzew pęknąć dzwono zaróść cmentarz dziki bz łza krzywda ludziezki krew księżyc otryt niebo pełny gwiazda tańczyć szary popielice usypiać bieszczad zaróść olcha pole dawny wieś orać zasiać pamiętać nikt skrzypieć martwy świerk drewniany płakać świat kończyć sokolik daleja lasa druty granica dzielić nacja dzielić ściana nienawiść przerażać san płytki beniowy brzeg dzielić ludziezie dzielić myślić straszny gniew,Maciej Augustyn,Eugeniusz Olejarczyk,KSU
943,Za mgłą,dosyć częsty rozważać wart me żyto setka zgrany kawałek miraż szczyt chwila najczęunioezioro ruszać połonina zmęczyć wspinaczka człowiek stawać dół zostać męczyć patrzyć góry wokoło świat wydawać lepszy dół zostać męczyć patrzyć góry wokoło świat wydawać lepszy uczesać wiatry goły szczyt połonina prosić bybyć pójść bies czad skłonić twarz mokry deszcz przeziębnąć zmęczyć zły rzecz dół mgły oddzielić dół,Maciej Augustyn,Eugeniusz Olejarczyk,KSU
944,Iść w stronę słońca,iść ciągło iść strona słońce strona słońce horyzont kresa iść ciągło iść koniec witać przebudzić dzień wciąż witać nadzieja dobry znak ufność tą pierwszy jasność odśpiewywać ptak iść ciągło podróża któyy ludzie prozaicznia żyć zwać iść iść najdłużeć plecy nadciągać noc najprostszy słowo poranny składać wiersza kolor raz zobaczyć niewidzialny iść ciągło iść trafiać celn zawiany piasek prawda ślad niepodzielnia oko dziecko mierzyć świat iść ciągło iść strona słońce strona słońce horyzont kresa,,Janusz Kruk,Dwa plus jeden
945,ETZ,kaska ogórek buda trzymać burka zenek wdzięk właściciel sztuczny szczęki czymż atrybut musieć dzień huta pędzić komar kolor świt nażreć wstyd jazda etz ciejski dobry jazda świat jazda komarzy powodować inflacja marzyć wieźć bak gdyśmeć wjechać poła burak burak pastewny wjechać glebnąć kumpel jeść kotlet pieniądz wciskać skarpeta etz tę zacięty mama dokładać renta jazda przykład easa rider jeździć motor frajda rider em niewąski choć wieś grunt grząski głowa sytuacja otworzyć przestrzeń wiatr wibracja kupić perfumy zapach świeży palić guma jazda piękny costaricnie woli schlać rzygać woleć chybać wiedzieć woleć jazda etz ciejski jazda,Andrzej Trojak,,Grupa Furmana
946,"Zrób, co możesz",ważki trzysta tysiąc lustro oko uwierzyć jakże nieważki wobecórka cudo zły zaledwie chwila jedyny raz zjawiać zrób móc tył zapamiętać źle pozwolić dar zdumienie znaleźć sens ufać zrób móc istnienie kropla krew światły odległy mgławica gnać sto milion mijać droga tysiąc świat lepsze świat zaledwie chwila jedyny raz zjawiać zrób móc tył zapamiętać źle pozwolić zachwycić znaleźć sens ufać zrób zrobić cichy zamknąć drzwi wciąż późny odkryć zmienić ważki żyto dbać część,Marcin Kydryński,Anna Maria Jopek,Anna Maria Jopek
947,"Tam, gdzie nie sięga wzrok",ruszyć chcieć daleki drogi sięgać wzrok musieć wziąć oddech zrobić pierwszy krok c d c f g c d choć serce lęk cofać warta żyć chmura lśnić szczyt odważyć iść c disa c disa świat kochać śmieć iść wiatr znać dal ruszyć chcieć daleki drogi sięgać wzrok musieć wziąć oddech zrobić krok ruszyć chcieć tę daleki drogi sięgać wzrok musieć wziąć oddech zrobić krok ruszyć chcieć,M. Czapińska,Pat Matheny i Lyle Mays,Anna Maria Jopek
948,Na dłoni,łatwy ręka wymykać uciekać wciąż znikać mgła chcieć własność chcieć zamknąć kluczyć świat schować skryć skarbić prywatny skarbić niemożliwy szczęście przelotny gość szczęście piórko dłoń zjawiać chcieć goń chcieć wymyślać proch chcieć sięgnąć gwiazda ciągło brak szczęście wciąż brak zachłann brak otworzyć oko szczęście chwila trwać niepewny uroda zieleń drzewo dziecko śmiech słońce zachód wschód patrzyć dal szczęście zwyczajny dzień zapach dom wśród chmura ciszyć trawić blisko blisko blisko szczęście przelotny gość przebłysk słoneczny pogoda wieć pojąć szczęście garść pełny woda,,,Anna Maria Jopek
949,Ja wysiadam,niech zatrzymać wreszta świat wysiadać pierwszy stacja niech zatrzymać wreszta świat wysiadać żyto chcieć gnać dech kołowrotek bezwoln kręcić gubić wątek dzień bies wciąż powtarzać prędzy żyto żeby pożyć spytać siebie żyto żeby pożyć kołowrotek pęknąć nić kołowrotek bezwoln kręcić gubić wątek dzień bies wciąż powtarzać prędzy niech zatrzymać wreszta świat wysiadać pierwszy stacja chcieć nikt ścigać siła opadać żyto chcieć gnać dech tracić czas szukać dobry gwiazda gapić dziura niebo najdłużeć kochać szkoda zmierzch poranek noc kołowrotek,M. Czapińska,M. Pospieszalski,Anna Maria Jopek
950,Nienasycenie,niesteta noc samotny zachłanny wspólny sn splot dech dotyk stopa czuły gest niesteta myślić niewinny podnieta rządzić nieskromny zły składać wzór asceta nienasycenie płoń niemy ogień niesteta duch zaleta kobieta chcieć przymierze ciało światowy stylo nienasycenie niebo strącać niesteta chwila wytchnienie zmysł odejść znaleźć anioł niech zgasnąć me nienasycenie,,,Anna Maria Jopek
951,Kołysanna,spać maleńki spać dzień śnić kochany niech senior znać smutek ani zły póky spać wiedzieć wokół mijać mijać mijać pierwszy mijać budzić uwierzyć wokół mijać,Marcin Kydryński,Robert Amirian,Anna Maria Jopek
952,Ale jestem,oko otwierać stawać świat niebo sad jabłko zielony zapach smak prosty żyć naprawda żeby oszukać czas żyć najpięknieć żyć raz żyć zachwyt marzyć kochać śnić czas oszukać żeby naprawda żyć piasek ziarenko klepsydra zabłąkany łódeczka wśród rafa kroplić deszcz trzcina myślić wśród trawić iskra wiatr powiew smuga światły biec gwiazda chwila prześcignąć chcieć czas ucho nadstawiać słuchać grać muzyka muzyka wielki cisza pochłonąć pragnąć wyśpiewać wyśpiewać żyć naprawda żeby oszukać pędzić czas piękno żyć zachwyt żyto zdarzać raz piasek ziarenko klepsydra zabłąkany łódeczka wśród rafa kroplić deszcz trzcina myślić wśród trawić żyto drogi żyto sen pot wiedzieć wiedzieć pytać dowiedzieć skończyć drogi żyto zen piasek ziarenko klepsydra zabłąkany łódeczka wśród rafa kroplić deszcz trzcina myślić wśród trawić iskra wiatr powiew smuga światły biec gwiazda chwila prześcignąć chcieć czas,T. Lewandowski,M. Czapińska,Anna Maria Jopek
953,Nim słońce wstanie,słońce wstać minia kochanie zapomnieć zapomnieć zania krtań zgasnąć śpiewać zapomnieć zapomnieć niebo milczeć sprawa rzecz anioł niepamięć słońce wstać minia kochanie zapomnieć zapomnieć zania stanąć lepsze zamienić zamienić ląd granica wino taniec zamienić zamienić niebo taniec zania stanąć,,,Anna Maria Jopek
954,Małe dzieci po to są,niespokojny przystań demon wojna wiyć trwać wojna toczyć pierwszy dzień umieć oswoić póky czas wieć dama dziecko tysiąckrotnia zwrócić uczyć miłość zania pojąć przegrywać wojna zaczynać przyjść wiedzieć iść wieć szaleństwo rozmiar człowiek zapamiętać dziecko kochać religia pamięć mały dziecko kochać najmądry księga zachować mówić dziecko kochać,Marcin Kydryński,Marcin Pospieszalski,Anna Maria Jopek
955,Joszko Broda,joszka grać bożyć świat zdumienie słuchać joszka grać drumla grać liść grać serce ucho czul nikt dobry bóg dać talent reszta joszka wygrać tył jasny nuty tył ciemny nuty tył muzyka dokół tył złoty struna tył srebrny struna dźwięk zaklęty wiolin bas bóg dawać talent reszta musieć wygrać niech zegar spać otrzeć ślad łza oby joszka grać czas kresa dzień zaprzyjaźnić spróbować widzieć świat pozytywn źle mówić świat biec łąka joszka grać zaśpiewać znaleźć czuły rym muzyka serdeczny rym dobry bóg dawać talent reszta szukać,"M. Czapińska, M. Kydryński",T. Lewandowski,Anna Maria Jopek
956,Dłoń zanurzasz we śnie,dłoń zanurzać śnąć zagrobowy cień znajdywać wołać imię leżeć brak dech oto ciało oto ciało,Bolesław Leśmian,Jan Janga Tomaszewski,Anna Maria Jopek
957,Zanim zasnę,prosić pozwolić zasnąć włos chcieć słyszeć senior szept krew chcieć dotyk ustęp czysty chrzest zbudzić świta chłód łza zania chłód zania lęk zania świta zania dzień chcieć strzec sn tulić cień prosić pozwolić czekać deszcz kroplić drżeć skraj rzęsa chcieć znać zen prosić własny świat wracać chcieć mówić lepiej mówić prosić pozwolić raz poczuć dreszcz niech ciało grać wiatr skroń wierzba pozwolić prosić niech noc odebrać wzrok źrenica sto skóra ręka mówić lepiej mówić póky milczeć wiedzieć wciąż czas chcieć światło dzień pieścić twarz prosić pozwolić tę ostatni próba odejść stąd ślad stopa,M. Kydryński,M. Pospieszalski,Anna Maria Jopek
958,Tao,przystań chwila zatrzymać świat spieszyć zdążyć wczorać jutro znaczyć przestać spieszyć nauczyć tao prowadzić prosty drogi szukać zły ni dobry znaleźć znaleźć bybyć móc płynąć nurt rzeka walczyć poddać woda wziąć oddech płynąć trawa wieja wiatr słabość siła chronić świat przystań chwila zatrzymać świat spieszyć zdążyć wczorać jutro znaczyć przestać spieszyć nauczyć przystań chwila zatrzymać świat spieszyć zdążyć,M. Czapińska,M. Pospieszalski,Anna Maria Jopek
959,Zabraknie Ci psa,pójść precć pójść precć zagubinowy oddalić zniknąć głowa płowy doczekać dzień zabraknąć ps doczekać dzień zabraknąć ps łasić ręka przypadać skała skamleć żebybyć pogłaskać uzyskiwać łkanie błaganie niechać wieć wieć dziewczęcy serce coraz twardnieć pójść precć pójść precć patagonia żebybyć zadowolony,Edward Stachura,Krzysztof Myszkowski,Stare Dobre Małżeństwo
960,Erotyk,wchodzić wilgoć porowatość ziemia spalać płomień biały ciało świeca wyparować wilgoć zgasnąć świeca zsunąć zmęczyć głębić woda kamień zamknąć oko widzieć jaśnieć funkcja wzrok przejąć dotyk zanurzać wrzeć wnętrze erotyka erotyka,Jan Rybowicz,Krzysztof Myszkowski,Stare Dobre Małżeństwo
961,Piosenka o nadziei,wciąż plecy odwrócić widnokrąg ruchomy jutrzenny poświata zbliżać oddalać pieśń układać stóg gwiazda szukać brnąć bór las los znikać głos dopędzać wreszta obracać twarz kostusia stary świat wryć stawać czas,Józef Baran,Krzysztof Myszkowski,Stare Dobre Małżeństwo
962,Smutno,szumieć chmura szumieć drzewo jesień jesień cichy wrzawa niba senior pożółknąć trawa przedmieście wieczór zabawa zjawić tańczyć słońce nowy wybrany głowa kręcić pierś mocny bić gdybymorze móc gdybymorze móc wydrzeć serce odrzucić serce serce lepiej lepiej najlepiej choć wiedzieć wiedzieć wiedzieć smutny smutny smutny smutny smutny smutny szumieć chmura szumieć drzewo jesień jesienny cichy wrzawa cień lampić kołysać trawa przedmieście dawny zabawa ciągło oko tańczyć słońce patrzyć wciąż głowa kręty wciąż duszny boleć coraz gdybymorze móc gdybymorze móc wydrzeć serce odrzucić serce serce lepiej lepiej najlepiej choć wiedzieć wiedzieć wiedzieć smutny smutny smutny smutny smutny smutny,,,Stare Dobre Małżeństwo
963,Przyda się taka chwila,dać oddech pełny garść chwila bóg zwolnić czas niech choćba maj trwać tył styczeń trzy czas bóg ubyć móc wszędziejski przydać chwila żeby żyć zatrzymać dać miłość pełny garść chwila bóg zwolnić czas niech uciekać mgły niech dodawać dzień dzień,A. Ziemianin,Krzysztof Myszkowski,Stare Dobre Małżeństwo
964,Piosenka zauroczonego,ciągnąć mnich niebo cygan skrzypce głodny chleb pijak szklanka miód niedźwiedź oślepić pallicha ciągnąć ciągnąć ciągnąć ciągnąć ciągnąć wędrowiec drogi karciarz karty zły dobry bógwiejak diabli anioł oko zawziąć,Józef Baran,Krzysztof Myszkowski,Stare Dobre Małżeństwo
965,Pod kątem ostrym,domowy ostatni ledwa stać noga stół przechylać jeść obiad podłoga grzbiet prężyć klepka trzeszczeć móc złapać równowaga przechylić mrocznia domowy chwila mieszkać kąt równy pochyły wrócić kwiat wazon oswoić cichy pić woda,Adam Ziemianin,Krzysztof Myszkowski,Stare Dobre Małżeństwo
966,Sen bez snu,północ dawać sn noc kazać rozmawiać gwiazda komar upijać mą krew piszczeć ucho głupia sprawa metafizyka tę noc tępy ból istnienie księżyc krążek stary płyta dawny nikt zmieniać chodzić dom klatka pić kolejny szalony herbata komar piłować cienki krzyk daleja trzymać warta modlić trudny taii noc wiedzieć najlepiej bóg wyjść próg poranny wstawać zorze,Adam Ziemianin,Roman Ziobro,Stare Dobre Małżeństwo
967,Nocna pieśń żarówki,żarówka noc wolny wisieć sufit kołysać wisielec jasny patrzyć przyszłość żarówka chwila mały łysy śpiewaczka śpiewać chcieć obłęd najtrudnieć zasnąć żarówka hotel prąd wartki płynąć żyła rozgarniać włos noc późny godzina żarówka setka kochać zgasić patrzyć oko mały,Adam Ziemianin,Krzysztof Myszkowski,Stare Dobre Małżeństwo
968,"Z rozkazu serca, ognia, powietrza i wody",pierś piękno wezbrany całować włos falować rozrzucony trawa powietrze amen składać uklęknąć kolano modlitwa ważki nieruchomy stały liść zadumany rozkaz serce ogień powietrze woda wchodzić raz gorący schód rozkaz serce ogień powietrze woda wchodzić raz gorący schód sarna spłoszyć biegły dłoń ręka prowadzić biały topór słońce obcinać gałęzie sosna strzelać niebo coraz szalony ucieczka śmierć rozkaz serce nagle wybuchnąć równina szeroki otworzyć oko dziwić mówić gorączka pokazywać dzwonki ślad prosty niebo prowadzić rozkaz serce pierś piękno wezbrany całować modlitwa ważki nieruchomy stały modlitwa ważki rozkaz serce,,,Stare Dobre Małżeństwo
969,Beretka dla Bejdaka,skraj niebo iść bejdak organki odpust grać kałuża żaba łyżka zamieszać zdawać sprawa podobny widzieć żaba łasić kolano żeby kumkać pasieka ul spowiadać pszczoły miód serce lać poprosić łąka skosić zioło głaskać tulić trawa umieć człowiek żyć raczy kumplować ptak kiedyś rano odlecieć niebieski ptasi polana umieć człowiek żyć wróbel wracać bóg uprosić lot ptak chwila gość bóg słabość jednaki kochać bejdak,Adam Ziemianin,Krzysztof Myszkowski,Stare Dobre Małżeństwo
970,Zobaczysz,kochać przestać zobaczyć zobaczyć obcy własny twarz wielki oko strach zobaczyć zobaczyć ziemia zobaczyć ziemia ziemia nosić ogień zobaczyć ogień ogień brodzić woda zobaczyć woda woda chłodzić wiatr zobaczyć wiatr wiatr koić żywioła złorzeczyć lepiej bybyć przepaść wieść,Edward Stachura,Krzysztof Myszkowski,Stare Dobre Małżeństwo
971,Miejska strona księżyca,miasto zima strasznia kaszleć piwnica węgiel woda szczur wciąż powód strach coraz mało duma dziewczyna planty dziwny dom uciec pierwszy lepsze pociąg złapać próbować atmosfera miasto żyć ciągnąć bok miasto wiosna straszny choć żyć chybać cena słońce rynek moneta kłaść dziewczyna planty skubać ptak uciec miasteczko znudzić gołąb gołąb kawka chwila miły miasto lato suchy gardło żyć księżyc twarz ukazywać miejski wyjść dziewczyna planty siódmy niebo miasteczko śnić makijaż twarz mocny trzymać noc jasny miasto jesień lekki gasnąć powolić kurczyć wcześnieć płony latarnia knajpa kończyć piwo dziewczyna planty trocha osowieć miasteczko pamiętać miejski księżyc zaglądać oko chwila chybać święty,A. Ziemianin,K. Myszkowski,Stare Dobre Małżeństwo
972,Niebieski cyrkiel,chwila dać miejsce twej ziemia cienki linia drogi cyrkiel wyznaczyć wodzić wciąż ścieżka kręty trawa szeptać imię hymn śpiewać chwała złość syczeć ząb tył skrajny dawny przekroczyć tył decyzja koniec błędny wciąż uczyć żyć własny skóra płacić umieć dziwny rachunek,Adam Ziemianin,Krzysztof Myszkowski,Stare Dobre Małżeństwo
973,Szarak w beretce,iść szarak beretka pierwszy zmiana termos ciągnąć chiński cień teczka drugie śniadanie wlec noga noga szary płótno przedświt kupować ranny gazeta nabrzmiały dobrobyt pot smutny tramwaj porywać nagle szary koniec gubić tłum góry makatka starzey niedźwiedź mocny śpać zbudzić bać iść szarak waciak nocny zmiana termos ciągnąć chiński treść teczka kęs podgardlany wlec noga noga szary płótno wieczór radio sekretarz mówić społeczn pomóc pot nocny tramwaj usypiać nagle szary koniec łapać wiatr żagle góry makatka starzey niedźwiedź mocny śpać zbudzić bać zbudzić rządzić rządzić wielki trud,,,Stare Dobre Małżeństwo
974,Muszyna,dzień krótki krok burmistrz głupi gienek lipa gadać rzeka stoa miejscowy heraklit ziemia nosić sąsiad panna dziecko szukać ojciec lis miasteczko znać sąsiad dostać lista ameryk piekarz pijany koń wielki wóz przeciągnąć niebo pies poskarżyć księżyc góra pochyły wiatr trawa zagrać blues miasteczko da skrót miasteczko przejść rynek zaraza wziąć język któś winny dzień krótki kroki burmistrz jesień góry schodzić leszczyna powolić zapadać senior zimowy raz blues muszyna,Adam Ziemianin,Krzysztof Myszkowski,Stare Dobre Małżeństwo
975,W nicość śniąca się droga,poistnieć czerwień niebiosy ubocze poistnieć nikt raczy wbrewa umieć powiedzieć uległość oko zarys drzewo chmura trzebaż oko drzewo wiedzieć musza wypatrzeć nicość śnić droga odchodzić chwila chwila brak lico móc pieścić pieścić móc patrzyć zmierzch pragnąć widzieć usta usta blisko serce żal zatwardziały ręka biały wziąć złamać pamiętać ów ogród płot wysoki mgła niski mgły czlowiek niepotrzebny sen równy liść zaszeptać cień potoczyć drzewo zrozumieć lśnić usta tkwieć chłodny odrobina znużyć pójść ogród poszukać zmarły dzień ścieżka znajomy drzewo brama czay pamiętać iść minąć świat wdziać tę suknia włos uczesać pójść ogród iść pierwszy pójść ślad,,,Stare Dobre Małżeństwo
976,"Mrok na schodach, pustka w domu",mroka schód pustka dom pomóc nikt nikt ślad śnieg zaprószyć żalić śnieg zawieruszyć śnieg uwierzyć śnieg ośnieżyć ocienić cień pomilczeć milczenie,Bolesław Leśmian,Krzysztof Myszkowski,Stare Dobre Małżeństwo
977,U studni,spotkać kiedyś studnia wkołyć zielony żona odświętny wódka wypić pozwolić spotkać kiedyś studnia zwykły kołowrót woda chłodny świat uwierzyć powrót spotkać studnia drugie świat bóg łaskawy pewnie da tę pociecha spotkać kiedyś studnia wiyć żywy woda bellon zaprosić polewać spotkać studnia kiki młódź żona piękny wódka szkodzić,Adam Ziemianin,Krzysztof Myszkowski,Stare Dobre Małżeństwo
978,Ballada o listopadzie,listopad niekochany kobieta narzekać narzekać narzekać rozpuścić włos lustro czekać przeczytać lista drzewo znaleźć siebie rozrzucony leżeć stopa wiatr roznosić ziemia niebo popatrzyć gwiazda smutki reszta żyć pisany zanieść wariacki śmiech żeby nikt wiedzieć grać,Józef Baran,Krzysztof Myszkowski,Stare Dobre Małżeństwo
979,Anioł zimowy,anioł czapka ciepły wełna gorzeć anioł góry urwać wieczór nieść beskia nosić lis wrócić bieszczad ogrzać chcieć anioł grudniowy zimny połów zostać trocha zagrzać noga anioł styczniowy zmiłować zdążyć poznać niebieski polana anioł czapka anielski pompon anioł chcieć odlecieć wieczór daleja siedź trocha zagadkowy czapka miękki wełna zdejmować głowa anioł lutowy zimny połów zostać puszczać lód anioł marcowy zmiłować zdążyć odwiedzić niebieski polana anioł zasiedzieć następny zima niebieski cieszyć anioł raźn chybać bywać okno trzymać tęgi zimać anioł grudniowy zimny połów zostać trocha zagrzać noga anioł styczniowy zmiłować zdążyć poznać niebieski polana anioł lutowy zimny połów zostać puszczać lód anioł marcowy zmiłować zdążyć odwiedzić niebieski polana,,,Stare Dobre Małżeństwo
980,Rozliczysz mnie Panie,słabość rozliczyć błądzić drogi skrót buta nieść trzymać szalony sznurówka grzech rozliczyć wiek wiek amen małość rozliczyć cieszyć trawa pochylić piórko chcieć rano złowić wiersza wypuścić jaskółka kielich rozliczyć dymić jasny piano kufel głowa mej planeta chcieć ukryć,Adam Ziemian,Krzysztof Myszkowski,Stare Dobre Małżeństwo
981,Rozmowa bez słowa,choćba pomilczeć jakże ciekawć siedzieć piękny swej mały kawa podnosić filiżanka nazbyt wysoki jakbyś chcieć sprawdzić włos kochany oko kawowy jakże podziwiać cichy rozmowa,Adam Ziemianin,Krzysztof Myszkowski,Stare Dobre Małżeństwo
982,Przyszłaś znikąd (Topielica),przyjść znikąd ziemia woda san przyjąć twarz włos rozplatać splatać wiatr bieszczadówa pełny straż oko spojrzeć dno rzeka wilk kwadratoł schować stopa lec czuć coraz mało siła żeby wyjść nurt brzeg czuć coraz mało siła żeby wyjść nurt brzeg przyjść znikąd ziemia sukno mgły owinąć senior wiatr suknia lubieżnia podwiewać warkotać snuć włos lęk srebrny pstry wpłynąć dłoń srebrny lustro zamienić san czuć coraz mało siła puścić tan czuć coraz mało siła puścić tan wiatr tańczyć liść chybać chcieć tańczyć liść wiedzieć siła zebrać precć stąd iść chcieć widzieć dno san patrzyć twarz czuja coraz mało siła władza wciąż czuja coraz mało siła władza wciąż czuja coraz mało siła władza wciąż trwać,Bogdan Loebi,Krzysztof Myszkowski,Stare Dobre Małżeństwo
983,Już nie jestem ich,przyjeżdżać miasteczko naparstek galicja mały poznawać czas powozić dorożka wciąż wychodzić ludzie lepiej koń blisko wódka wypity tkwieć noga udać mówić rozgoryczyć ziemianin ciągło ziemia,A. Ziemianin,K. Myszkowski,Stare Dobre Małżeństwo
984,Czy warto,zwalić noga ruszyć krok noc szloch rozpacz warta warta chybać warta raczy warta warta warta zginąć żyła nóż dół bruk wysoki jechać miasto lasa błoń koń goń nieboskłon,Edward Stachura,Krzysztof Myszkowski,Stare Dobre Małżeństwo
985,Kompot z rabarbaru,pamiętać imię kolor włos oko wiedzieć okazja ostrożeń wydobywać pamięć gest postawić kompot rabarbar zaraza przerażony chować panika rucho ręka powrót niepamięć zwariować czułość pamiętać imię kolor włos oko wiedzieć okazja,,,Stare Dobre Małżeństwo
986,Przypalanka na spirytusie,powiadać powiadać spirytus wypalić powiadać powiadać spirytus potrafić serce miód żołądek pieprz rozterka przypalanka poprawić wiwat dacha wesele mocnieć kolacja flaszka święty kac odwaga drugi cywil chwila głowa szumieć szczęście powietrze głupota pot frasunek mocny trunek spokój naród,Adam Ziemianin,Krzysztof Myszkowski,Stare Dobre Małżeństwo
987,Zdziwiona,piękno dziwy zdziwiony zdziwienie myśliwy dziwić ramię zdziwienie podnosić brew coraz piękny zdziwienie otwierać drzwi wejść daleja móc piękno dziwy ciągło zaskoczyć zdziwienie tracić siła daleja zdziwiony dziwy płytki talerz zadziwiać skrzynka pocztowy zaleta niech wciąż zdziwiony,Adam Ziemianin,Krzysztof Myszkowski,Stare Dobre Małżeństwo
988,Pożegnanie,spotkać kilaa rok koniec świat wciąż udo zacząć raz musza odejść zatrzymywać rok zmienić rozstawić straża wokół zen dać wreszta spokój dosyć słowo wrócić pewny nadejść porać zapamiętać mówić wczorać zapamiętać zmienić myślić myśleć wierzyć wierzyć wrócić zrozumieć kilaa rok koniec świat wciąż udo zacząć raz,Piotr Bakal,Krzysztof Myszkowski,Stare Dobre Małżeństwo
989,Banita,oto wypędzać szatan oto wypędzać anioł wypędzać serce oba oba częsty niech przyjść skrzydło własny rdzewny niech przyjść żyć skrzydło własny rdzewny wypędzić szatan wypędzić anioł serce wstąpić wiatr zamieszkać szumieć dom stać lasa las bić piorun dom stać lasa las bić piorun ciężki żyć szatan ciężki żyć anioł banita boski los wybrać wybrać dziewczyna któyy ubóstwiać wybrać dziewczyna któyy ubóstwiać,E. Stachura,K. Myszkowski,Stare Dobre Małżeństwo
990,Pod kątem rozwartym,kit ziemia kit ramię rozwarty biec przeczekać burza ostry wiatry piorunochron gradobicie świat zbierać chcieć chronić umieć zakręt ziemia kit ziemia kit ramię rozwarty raz raźn rozegrać dzić rozdać karty lampa oświetlać gościniec mroczny wciąż wyboisty krok krok iść siebie lkki,Adam Ziemianin,Roman Ziobro,Stare Dobre Małżeństwo
